"Koaty Elite WM711 Bluetooth Mouse with Additional USB Type C & Type A Reciever, Silent, upto1600 DPI, Triple Device Connectivity, Compatible with Mac, Laptop, Tablet",Computers,749.0,1101.47,32,4.3,144,626.52,1.2,590,Koaty,0.0,0.9,1.0,0.5,0.0,5.741,0.1888,949.0,0.7892518440463646,749.0,1.0,619.1999999999999,2.66644446296142,0.0,,
"Portronics Toad 7 Wireless Mouse, Bluetooth 5.3V & 2.4 GHz Wireless, Adjust Sensitivity Upto 3200 DPI, Rechargeable Built in Battery(Black)",Computers,479.0,1496.88,68,4.6,101,455.05,1.05,457,Portronics,0.0,0.9,0.0,0.5,0.0,9.6033,0.3108,949.0,0.5047418335089568,596.45,0.8030849191047028,464.59999999999997,6.475573754880488,0.0,,
"ZEBRONICS Blanc Slim Wireless Mouse with Rechargeable Battery, BT + 2.4GHz, 4 Buttons, 800/1200/1600 DPI, Silent Operation, Multicolor LED Lights",Computers,479.0,798.33,40,3.9,519,398.94,1.2,2003,ZEBRONICS,0.0,0.9,0.0,0.5,0.0,8.142,0.8012,949.0,0.5047418335089568,729.1,0.6569743519407488,2024.1,3.333055578701775,0.0,,
"Portronics Toad II Bluetooth Mouse, with Bluetooth 5.0 & 2.4 Ghz Dual Wireless Connectivity, Rechargeable Battery, Adjustable DPI up to 1600 Compatible with Laptop, MacBook, PC (Grey)",Computers,519.0,1674.19,69,4.2,3804,493.05,1.05,15274,Portronics,0.0,0.9,0.0,0.5,0.0,8.0925,10.5391,949.0,0.5468914646996839,596.45,0.8701483779025903,15976.800000000001,6.570802780687554,0.0,,
"Acer Beam Wireless & Bluetooth Rechargeable Mouse, USB Receiver, LED Colors, Bluetooth 5.1 + 2.4G Mini Lightweight Design for Office/PC/Mac/Laptop/Apple/ipad (Black)",Computers,399.0,997.5,60,3.3,17,379.05,1.05,64,Apple,2.0,0.9,0.0,0.5,0.0,8.2707,0.0384,949.0,0.4204425711275026,690.6666666666666,0.5777027027027027,56.099999999999994,5.71374154842396,1.8,,
"Logitech M240 Silent Bluetooth Mouse, Wireless, Compact, Portable, Smooth Tracking, 18-Month Battery, for Windows, macOS, ChromeOS, Compatible with PC, Mac, Laptop, Tablets - Graphite",Computers,1095.0,1586.96,31,4.4,896,838.53,1.31,6159,Logitech,0.0,0.9,2.0,0.5,0.0,4.0183,1.9093,949.0,1.1538461538461535,1487.9333333333334,0.7359200681034096,3942.4000000000005,2.366231585375162,0.0,,
"Logitech M196 Bluetooth Wireless Mouse, Compact and Portable Mouse for Laptops, Tablets and More, 12-Month Battery, Smooth Tracking, Compatible with PC and Mac, Windows and macOS - Graphite",Computers,1125.0,1388.89,19,3.9,41,749.05,1.5,203,Logitech,0.0,0.9,2.0,0.5,0.0,3.4667,0.0386,949.0,1.1854583772391991,1487.9333333333334,0.7560822617500784,159.9,1.2665822278514767,0.0,,
"Arctic Fox Pureview Transparent Wireless and Bluetooth Rechargeable Mouse, USB Receiver,LED Battery Magic Silm for Office/PC/Mac/Laptop/Apple/ipad(Space Blue)",Computers,599.0,1618.92,63,4.3,3073,569.05,1.05,11800,Apple,2.0,0.9,1.0,0.5,0.0,7.1786,7.434,949.0,0.631190727081138,690.6666666666666,0.8672779922779923,13213.9,5.999428625845158,1.8,,
"Logitech B170 Wireless Mouse, 2.4 GHz with USB Nano Receiver, Optical Tracking, 12-Months Battery Life, Ambidextrous, PC/Mac/Laptop - Black",Computers,629.0,796.2,21,4.3,77158,349.4,1.8,337311,Logitech,0.0,0.9,1.0,0.5,0.0,6.8362,70.8353,949.0,0.6628029504741834,1487.9333333333334,0.4227339934584883,331779.39999999997,1.1666018554524749,0.0,,
"Acer Beam Wireless & Bluetooth Rechargeable Mouse, USB Receiver, LED Colors, Bluetooth 5.1 + 2.4G Mini Lightweight Design for Office/PC/Mac/Laptop/Apple/ipad (Silver)",Computers,399.0,997.5,60,3.4,24,379.05,1.05,121,Apple,2.0,0.9,0.0,0.5,0.0,8.5213,0.0726,949.0,0.4204425711275026,690.6666666666666,0.5777027027027027,81.6,5.71374154842396,1.8,,
"HP 240 Bluetooth Wireless Mouse with 3 Buttons/1600 DPI Red Optical Tracking/Sleek and Ambidextrous/Compatible to Windows 10, macOS, Chrome OS, 3 Years Warranty (Black)",Computers,799.0,1700.0,53,4.1,2714,759.05,1.05,11475,HP,1.0,0.9,2.0,0.5,0.0,5.1314,6.0818,949.0,0.8419388830347735,595.4285714285714,1.341890595009597,11127.4,5.047138367774498,0.9,,
"Lenovo 600 Bluetooth 5.0 Silent Mouse: Compact, Portable, Dongle-Free Multi-Device connectivity with Microsoft Swift Pair | 3-Level Adjustable DPI up to 2400 | Battery Life: up to 1 yr",Computers,1669.0,2877.59,42,4.5,6334,1585.55,1.05,45287,Lenovo,1.0,0.9,2.0,0.5,0.0,2.6962,19.0205,949.0,1.7586933614330875,969.0,1.7223942208462333,28503.0,3.999619083896772,0.9,,
"ZEBRONICS Pulse Wireless Mouse, Multi Connectivity, Dual Bluetooth, for Mac, Laptop, Computer, Tablet, 2.4GHz, 1200 DPI, Comfortable & Lightweight (Black)",Computers,399.0,595.52,33,3.8,1087,314.34,1.27,4526,ZEBRONICS,0.0,0.9,0.0,0.5,0.0,9.5238,1.4936,949.0,0.4204425711275026,729.1,0.5472500342888492,4130.599999999999,2.598220612550193,0.0,,
"Logitech M221 Wireless Mouse, Silent Buttons, 2.4 GHz with USB Mini Receiver, 1000 DPI Optical Tracking, 18-Month Battery Life, Ambidextrous PC/Mac/Laptop - Charcoal Grey",Computers,695.0,1287.04,46,4.3,41745,640.21,1.09,156257,Logitech,0.0,0.9,1.0,0.5,0.0,6.1871,71.8782,949.0,0.7323498419388831,1487.9333333333334,0.4670908194811595,179503.5,4.219796348958811,0.0,,
"iClever Bluetooth Mouse MD172, Wireless Mouse Dual Mode(Bluetooth+USB), Multi-Devices Ergonomic Mouse with 5 Adjustable DPI and 7 Buttons, Rechargeable Silent Mice for Laptop/iPad/MacBook/Tablet/PC",Computers,2499.0,4030.65,38,4.1,2095,2374.05,1.05,11947,Generic,0.0,0.9,2.0,0.5,0.0,1.6407,4.5399,949.0,2.6332982086406744,1639.7894736842106,1.5239761201694697,8589.5,3.618702980668508,0.0,,
"ASUS Marshmallow Md100 USB Mouse, Silent Button, Up to 1600 Dpi, Dual-Mode Connection, (Grey)",Computers,1199.0,2924.39,59,4.4,1341,1139.05,1.05,6346,ASUS,0.0,0.9,2.0,0.5,0.0,3.6697,3.7441,949.0,1.263435194942044,1199.0,1.0,5900.400000000001,5.618512522616894,0.0,,
Amkette Hush Pro Epic Rechargeable Wireless Mouse | 3 Device Connectivity with Bluetooth and USB 2.4 GHz | 2400 DPI | Silent Switches | Ergonomic Design | Type C Charging | Black,Computers,779.0,1298.33,40,4.2,175,740.05,1.05,1152,Amkette,0.0,0.9,2.0,0.5,0.0,5.3915,0.4608,949.0,0.8208640674394099,779.0,1.0,735.0,3.80916103228264,0.0,,
"BenQ GW2490 24"" 1920x1080p FHD IPS Monitor| 100Hz|99% sRGB|Eye-careU|Dual HDMI|Display Port|Bezel-Less|Eyesafe|VESA MediaSync|B.I.|Low Blue Light+| Speakers|VESA Wall mountable(Black)",Computers,8250.0,825000.0,99,4.3,5086,7837.5,1.05,50420,BenQ,0.0,0.9,1.0,0.5,0.0,0.5212,49.9158,949.0,8.69336143308746,9374.0,0.8800938766801792,21869.8,9.427673554899535,0.0,,
"BenQ GW2790 27"" 1920x1080p FHD IPS Monitor| 100Hz|99% sRGB|Eye-careU|Dual HDMI|Display Port|Bezel-Less|Eyesafe|VESA MediaSync|B.I.|Low Blue Light+| Speakers|VESA Wall mountable(Black)",Computers,10498.0,1049800.0,99,4.3,458,9973.1,1.05,2829,BenQ,0.0,0.9,2.0,0.5,0.0,0.4096,2.8007,949.0,11.062170706006322,9374.0,1.1199061233198209,1969.3999999999999,9.427673554899535,0.0,,
"FRONTECH 20 Inch HD LED Monitor | Refresh Rate 60 Hz, 1600 x 900 Pixels | Wall Mountable Slim & Stylish Design with 16.7M Colors | HDMI & VGA Ports, Built-in Power Supply (MON-0054,Black)",Computers,2839.0,8111.43,65,3.3,2518,2697.05,1.05,17660,FRONTECH,0.0,0.9,0.0,0.5,0.0,1.1624,11.479,949.0,2.9915700737618547,2931.0,0.9686113954281816,8309.4,6.18988667745929,0.0,,
"Acer EK220Q 21.5 Inch (54.61 cm) Full HD (1920x1080) Pixels VA Panel LCD Monitor with LED Back Light I 1 MS VRB, 100Hz Refresh I 250 Nits I HDMI & VGA Ports with HDMI Cable I Eye Care Features (Black)",Computers,5695.0,7695.95,26,4.3,2947,4889.25,1.16,22700,Acer,0.0,0.9,0.0,0.5,0.0,0.755,5.902,949.0,6.001053740779768,4038.0,1.4103516592372465,12672.1,2.241186104646151,0.0,,
"ZEBRONICS Zeb-V19Hd 18.5 Inch (46.99 Cm) Led Monitor with Supporting Hdmi, Vga Input, Hd 1366 X 768 Pixels, 16.7M Colors, Glossy Panel, Slim Design & Wall Mountable, Black",Computers,2899.0,7070.73,59,3.6,3979,2754.05,1.05,26163,ZEBRONICS,0.0,0.9,0.0,0.5,0.0,1.2418,15.4362,949.0,3.054794520547945,729.1,3.976134960910712,14324.4,5.618512522616894,0.0,,
"FRONTECH 20 Inch HD LED Monitor | Refresh Rate 60 Hz, 1600 x 900 Pixels | Wall Mountable Slim & Stylish Design with 16.7M Colors | HDMI & VGA Ports, Built-in Power Supply (MON-0054,Black)",Computers,2839.0,8111.43,65,3.3,2518,2697.05,1.05,14803,FRONTECH,0.0,0.9,0.0,0.5,0.0,1.1624,9.622,949.0,2.9915700737618547,2931.0,0.9686113954281816,8309.4,6.18988667745929,0.0,,
"Samsung 24-inch (60.46cm) FHD, IPS Display, 100 Hz, 1920 x 1080 Flat Monitor, Bezel Less Design, AMD FreeSync, Flicker Free, HDMI, Display Port (LS24C330GAWXXL, Black)",Computers,7699.0,16039.58,52,4.2,248,7314.05,1.05,2185,Samsung,2.0,0.9,1.0,0.5,0.0,0.5455,1.1362,949.0,8.112750263435196,4638.888888888889,1.6596646706586826,1041.6000000000001,4.951909341967432,1.8,,
"Acer Nitro VG240Y M3 23.8 Inch IPS Full HD Gaming LCD Monitor with LED Backlight I AMD Freesync Premium I 0.5 MS Response, 180 Hz Refresh Rate I 2 x HDMI, 1 x DP I Stereo Speakers I HDR 10 I Black",Computers,7999.0,14033.33,43,4.1,3900,7331.33,1.09,40666,Acer,0.0,0.9,1.0,0.5,0.0,0.5126,17.4864,949.0,8.428872497365647,4038.0,1.980931154036652,15989.999999999998,3.944592239244106,0.0,,
"Samsung 27-Inch(68.5cm) FHD, 1800R Curved 1,920 X 1,080 LED Monitor, VA Panel, Slim Design, AMD Freesync, Flicker Free, HDMI, Audio Port (LC27R500FHWXXL, Dark Blue Gray)",Computers,10399.0,23108.89,55,4.3,363,9879.05,1.05,2765,Samsung,2.0,0.9,2.0,0.5,0.0,0.4135,1.5208,949.0,10.957850368809272,4638.888888888889,2.2417005988023955,1560.8999999999999,5.2375964193886295,1.8,,
"Samsung 22-inch (54.6cm) FHD Flat 1,920 x 1,080 Monitor, IPS, 75 Hz, Bezel Less Design, AMD FreeSync, Flicker Free, HDMI, D-sub, (LS22C310EAWXXL, Black)",Computers,6799.0,11722.41,42,4.3,353,5853.5,1.16,2031,Samsung,2.0,0.9,1.0,0.5,0.0,0.6324,0.853,949.0,7.164383561643835,4638.888888888889,1.4656526946107784,1517.8999999999999,3.620377553659168,1.8,,
"LG 22 Inch (55cm) FHD Monitor 1920 x 1080, AMD FreeSync, VA, 100Hz, sRGB 99% Typ(CIE1931), Black Stabilizer, Virtual Borderless, Flicker Safe, Reader Mode, OnScreen Control, HDMI,VGA, 22MR410(Black)",Computers,6199.0,619900.0,99,4.1,463,5889.05,1.05,2682,LG,1.0,0.9,1.0,0.5,0.0,0.6614,2.6552,949.0,6.53213909378293,10449.0,0.593262513159154,1898.2999999999997,9.427673554899535,0.9,,
"FRONTECH 19 Inch High-Performance HD LED Monitor | Refresh Rate 75 Hz, 1440x900 Pixels | Slim & Stylish Design with 250 Nits Brightness | HDMI & VGA Ports, Built-in Power Supply (MON-0001,Black)",Computers,2739.0,7402.7,63,3.3,2518,2602.05,1.05,13424,FRONTECH,0.0,0.9,0.0,0.5,0.0,1.2048,8.4571,949.0,2.886195995785037,2931.0,0.9344933469805528,8309.4,5.999428625845158,0.0,,
"NEOD 4K UHD Touch Screen LED TV Ultra Touch Display Interactive Flat Panel Monitor Android 13, Google Certified |8GB 128GB|65 INCH",Computers,106500.0,273076.92,61,3.470723003482,0,101175.0,1.05,43,NEOD,0.0,0.9,2.0,0.5,0.0,0.0326,0.0262,949.0,112.22339304531086,141800.0,0.7510578279266573,0.0,5.808970574231026,0.0,,
"FRONTECH 22 Inch HD LED Monitor | Refresh Rate 60 Hz, 1680 X 1050 Pixels | Wall Mountable Slim & Stylish Design with 16.7M Colors| HDMI & VGA Ports, Built-in Power Supply (MON-0060,Black)",Computers,3499.0,8534.15,59,3.3,2518,3324.05,1.05,11398,FRONTECH,0.0,0.9,0.0,0.5,0.0,0.9431,6.7248,949.0,3.687038988408852,2931.0,1.1937905151825317,8309.4,5.618512522616894,0.0,,
"Acer EK240Y G0 23.8 Inch IPS Full HD 1920x1080 Backlit LED LCD Monitor I 1 MS VRB, 120Hz Refresh I 250 Nits I Zero Frame I HDMI & VGA Ports with HDMI Cable I Adaptive Sync I Eye Care Features (Black)",Computers,6655.0,8993.24,26,4.0,68,6322.25,1.05,476,Acer,0.0,0.9,1.0,0.5,0.0,0.6011,0.1238,949.0,7.012644889357218,4038.0,1.648093115403665,272.0,2.475954670983716,0.0,,
"Dell SE2725H 27""/68.58cm FHD Monitor,Aspect Ratio 16:9, 75Hz, Tilt, Brightness 300 cd/m2(Typical), 5ms, 3000:1 Contrast Ratio, 1xHDMI, 1xVGA, 1x Power Connector, 1x Security Lock, Comfortview Plus",Computers,8999.0,33329.63,73,4.2,950,8549.05,1.05,9626,Dell,1.0,0.9,2.0,0.5,0.0,0.4667,7.027,949.0,9.482613277133826,1595.6666666666667,5.639649049509087,3990.0,6.9517188839158175,0.9,,
"ZEBSTER GV120 20 Inch (50.8 cm) LED Monitor with Dual HDMI & VGA Input, HD+ 1600 x 900, 250nits Brightness, 16.7M Colors, 16:9 Aspect Ratio, Wall Mountable",Computers,2699.0,6920.51,61,3.6,121,2564.05,1.05,605,ZEBSTER,0.0,0.9,0.0,0.5,0.0,1.3338,0.369,949.0,2.84404636459431,2699.0,1.0,435.6,5.808970574231026,0.0,,
"Acer EK220Q Ebi 21.5 Inch IPS Full HD (1920x1080) Backlit LED LCD Monitor I 1 MS VRB, 100Hz Refresh I 250 Nits I 99% SRGB I HDMI & VGA Ports with HDMI Cable I AMD Free Sync I Eye Care Features (Black)",Computers,5998.0,599800.0,99,4.3,2947,5698.1,1.05,18356,Acer,0.0,0.9,1.0,0.5,0.0,0.7169,18.1724,949.0,6.3203371970495255,4038.0,1.4853888063397722,12672.1,9.427673554899535,0.0,,
"Samsung 27-inch (68.59cm) FHD, IPS Display, 100 Hz, 1920 x 1080 Flat Monitor, Bezel Less Design, AMD FreeSync, Flicker Free, HDMI, Display Port (LS27C330GAWXXL, Black)",Computers,10099.0,18033.93,44,3.9,100,9594.05,1.05,760,Samsung,2.0,0.9,2.0,0.5,0.0,0.3862,0.3344,949.0,10.64172813487882,4638.888888888889,2.1770299401197604,390.0,4.190077135510904,1.8,,
"LG 29WQ500 (29 inch) UltraWide FHD (2560 x 1080) IPS Monitor with AMD FreeSync™, 100Hz, 1ms, HDR10, OnScreen Control & Dual Controller, 3-Side Virtually Borderless, Dynamic Action Sync - Black",Computers,14699.0,23331.75,37,4.2,2065,13772.62,1.07,22806,LG,1.0,0.9,2.0,0.5,0.0,0.2857,8.4382,949.0,15.488935721812432,10449.0,1.406737486840846,8673.0,3.4576207831043826,0.9,,
"FRONTECH 19 Inch High-Performance HD LED Monitor | Refresh Rate 75 Hz, 1440x900 Pixels | Slim & Stylish Design with 250 Nits Brightness | HDMI & VGA Ports, Built-in Power Supply (MON-0001,Black)",Computers,2739.0,7402.7,63,3.3,2518,2602.05,1.05,16196,FRONTECH,0.0,0.9,0.0,0.5,0.0,1.2048,10.2035,949.0,2.886195995785037,2931.0,0.9344933469805528,8309.4,5.999428625845158,0.0,,
"NEOD IFP AI-Powered Interactive Display Panel Android 14 | 8GB RAM 128GB ROM,Octa-Core Processor,Multitouch Screen |86 INCH",Computers,212400.0,317014.93,33,3.96317042684654,0,127756.87,1.66,12,NEOD,0.0,0.9,2.0,0.5,0.0,0.0187,0.004,949.0,223.8145416227608,141800.0,1.4978843441466854,0.0,1.9878320583097404,0.0,,
"NEOD 65 Inch 4K UHD Touch Screen LED TV UltraTouch Display Interactive Flat Panel Monitor(3840 x 2160 Pixels) Android 13 | for for Teaching, School, College, Institute & Home |8GB 128GB|",Computers,106500.0,507142.86,79,3.70618402063561,0,101175.0,1.05,28,NEOD,0.0,0.9,2.0,0.5,0.0,0.0348,0.0221,949.0,112.22339304531086,141800.0,0.7510578279266573,0.0,7.523093038758214,0.0,,
"HP H150 Wireless in Ear Earbuds, Compatible with Tablets, Smartphones, Pcs, and Other Devices with Bluetooth,Noise-Reduction,Water Resistant Design,Black,0.036Kg",Audio,549.0,2495.45,78,2.7,162,521.55,1.05,516,HP,1.0,0.7,1.0,0.5,0.0,4.918,0.4025,774.0,0.7093023255813954,603.75,0.9093167701863354,437.40000000000003,7.427864012951148,0.7,,
"Noise Buds N1 Pro in-Ear True Wireless Earbuds with Metallic Finish, ANC(Upto 32Db), 60H of Playtime, Dual Pairing, Instacharge(10 Min=200 Min), BT V5.3(Chrome Green)",Audio,1499.0,4996.67,70,4.0,3455,1424.05,1.05,17285,Noise,0.0,0.7,2.0,0.5,0.0,2.6684,12.0995,774.0,1.9366925064599483,1505.060606060606,0.9959731813880444,13820.0,6.66603180649462,0.0,,
boAt Bassheads 100 in Ear Wired Earphones with Mic(Black),Audio,297.0,990.0,70,4.1,415275,282.15,1.05,1037245,Boat,0.0,0.7,0.0,0.5,0.0,13.8047,726.0715,774.0,0.38372093023255816,759.5535714285714,0.39101916069119547,1702627.4999999998,6.66603180649462,0.0,,
"ZEBRONICS Zeb-Bro in Ear Wired Earphones with Mic, 3.5mm Audio Jack, 10mm Drivers, Phone/Tablet Compatible(Blue) (Green)",Audio,159.0,397.5,60,3.5,57110,151.05,1.05,202359,ZEBRONICS,0.0,0.7,0.0,0.5,0.0,22.0126,121.4154,774.0,0.2054263565891473,153.7826086956522,1.03392705682782,199885.0,5.71374154842396,0.0,,
"JBL C100SI Wired In Ear Headphones with Mic, JBL Pure Bass Sound, One Button Multi-function Remote, Premium Metallic Finish, Angled Buds for Comfort fit (Black)",Audio,599.0,1302.17,54,4.1,197841,569.05,1.05,625368,JBL,1.0,0.7,1.0,0.5,0.0,6.8447,337.6987,774.0,0.7739018087855297,789.0,0.7591888466413181,811148.1,5.142367393581564,0.7,,
"Noise Buds VS104 Truly Wireless Earbuds with 45H of Playtime, Quad Mic with ENC, Instacharge(10 min=200 min), 13mm Driver,Low Latency, BT v5.2 (Mint Green)",Audio,799.0,3473.91,77,3.9,25106,759.05,1.05,64995,Noise,0.0,0.7,1.0,0.5,0.0,4.8811,50.0462,774.0,1.0322997416020672,1505.060606060606,0.5308756317071698,97913.4,7.332634987144082,0.0,,
"Oneplus Bullets Z2 Bluetooth Wireless in Ear Earphones with Mic, Bombastic Bass - 12.4 mm Drivers, 10 Mins Charge - 20 Hrs Music, 30 Hrs Battery Life, IP55 Dust and Water Resistant (Magico Black)",Audio,1299.0,2278.95,43,4.1,186412,1234.05,1.05,524014,Oneplus,0.0,0.7,2.0,0.5,0.0,3.1563,225.326,774.0,1.678294573643411,1299.0,1.0,764289.2,4.094848109703838,0.0,,
boAt Bassheads 152 in Ear Wired Earphones with Mic(Active Black),Audio,499.0,1313.16,62,4.1,78174,474.05,1.05,369573,Boat,0.0,0.7,1.0,0.5,0.0,8.2164,229.1353,774.0,0.6447028423772609,759.5535714285714,0.6569648524744328,320513.39999999997,5.904199600038092,0.0,,
"ZEBRONICS Zeb-Bro in Ear Wired Earphones with Mic, 3.5mm Audio Jack, 10mm Drivers, Phone/Tablet Compatible(Blue) (Black)",Audio,159.0,300.0,47,3.5,57110,88.06,1.81,269756,ZEBRONICS,0.0,0.7,0.0,0.5,0.0,22.0126,126.7853,774.0,0.2054263565891473,153.7826086956522,1.03392705682782,199885.0,2.59654162753439,0.0,,
Boult Audio BassBuds X1 in-Ear Wired Earphones with 10mm Extra Bass Driver and HD Sound with mic(Black),Audio,299.0,996.67,70,3.9,87989,284.05,1.05,230830,Boult,0.0,0.7,0.0,0.5,0.0,13.0435,161.581,774.0,0.3863049095607235,865.6666666666666,0.34539853677319987,343157.1,6.66603180649462,0.0,,
"Ambrane Wired in Ear Earphones with in-line Mic for Clear Calling, 14mm Dynamic Drivers for BoostedBass, 3.5mm Jack, Multi-Functional Controller (Stringz 38 Lite, Green)",Audio,179.0,447.5,60,3.8,4915,170.05,1.05,26149,Ambrane,0.0,0.7,0.0,0.5,0.0,21.2291,15.6894,774.0,0.23126614987080105,179.0,1.0,18677.0,5.71374154842396,0.0,,
"Boult X Mustang Newly Launched Dyno TWS Earbuds with 60H Playtime, App Support, Dual Pairing, 4 Mics ENC, 45ms Low Latency, 13mm Drivers, Touch Controls, Made in India, IPX5 Ear Buds Wireless (Grey)",Audio,1499.0,4996.67,70,4.1,4919,1424.05,1.05,13303,Boult,0.0,0.7,2.0,0.5,1.0,2.7352,9.3121,774.0,1.9366925064599483,865.6666666666666,1.731613400077012,20167.899999999998,6.66603180649462,0.0,,
"Fastrack Fpods FE100|BT5.4 TWS in Ear Earbuds, 40Hrs Playtime, 13mm Extra Deep Bass Drivers, Dual Mic ENC for Crystal Clear Calls, Low Latency Gaming Mode Upto 60ms - 120 Mins in 10 Mins",Audio,749.0,2996.0,75,3.6,3024,711.55,1.05,11801,Fastrack,0.0,0.7,1.0,0.5,0.0,4.8064,8.8507,774.0,0.9677002583979328,749.0,1.0,10886.4,7.14217693552995,0.0,,
"Samsung Original EHS64 Wired in Ear Earphones with Mic, Black",Audio,399.0,448.31,11,4.2,37985,165.41,2.41,197203,Samsung,2.0,0.7,0.0,0.5,0.0,10.5263,21.6923,774.0,0.5155038759689923,399.0,1.0,159537.0,0.45641259698767683,1.4,,
"boAt Airdopes 311 Pro, 50HRS Battery, Fast Charge, Dual Mics ENx Tech, Transparent LID, Low Latency, IPX4, IWP Tech, v5.3 Bluetooth Earbuds, TWS Ear Buds Wireless Earphones with mic (Active Black)",Audio,1019.0,5095.0,80,3.4,2888,968.05,1.05,8899,Boat,0.0,0.7,1.0,0.5,0.0,3.3366,7.1192,774.0,1.3165374677002584,759.5535714285714,1.3415775243916774,9819.199999999999,7.61832206456528,0.0,,
"boAt BassHeads 100 C Wired Earphones with Type-C Jack, in-Line Microphone, 10mm Drivers, Signature Sound, Integrated Controls & Multi-OS Compatibility(Grey)",Audio,499.0,1996.0,75,4.1,415275,474.05,1.05,1501380,Boat,0.0,0.7,1.0,0.5,0.0,8.2164,1126.035,774.0,0.6447028423772609,759.5535714285714,0.6569648524744328,1702627.4999999998,7.14217693552995,0.0,,
"OnePlus Nord Buds 3 Truly Wireless Bluetooth in Ear Earbuds with Up to 32Db Active Noise Cancellation,10Mins for 11Hours Fast Charging with Up to 43H Music Playback -Harmonic Gray",Audio,1999.0,2815.49,29,4.1,2882,1360.21,1.47,10426,Noise,0.0,0.7,2.0,0.5,0.0,2.051,3.0235,774.0,2.582687338501292,1505.060606060606,1.3281857168743834,11816.199999999999,1.9726549214339162,0.0,,
"Portronics Conch Theta C in Ear Type C Wired Earphones with in Line HD Mic, Powerful Audio, 14.2mm Driver, Unique Earbuds Design, TPE Anti Tangle Wire, in line Controls, Wide Compatibility(White)",Audio,279.0,797.14,65,4.0,828,265.05,1.05,2207,Portronics,0.0,0.7,0.0,0.5,0.0,14.3369,1.4345,774.0,0.36046511627906974,279.0,1.0,3312.0,6.18988667745929,0.0,,
"boAt Rockerz 255 Pro+, 60HRS Battery, Fast Charge, IPX7, Dual Pairing, Low Latency, Magnetic Earbuds, Bluetooth Neckband, Wireless with Mic Earphones (Active Black)",Audio,1089.0,4033.33,73,4.0,210157,1034.55,1.05,933526,Boat,0.0,0.7,2.0,0.5,0.0,3.6731,681.474,774.0,1.4069767441860466,759.5535714285714,1.4337369225343835,840628.0,6.9517188839158175,0.0,,
"ZEBRONICS Zeb-Bro in Ear Wired Earphones with Mic, 3.5mm Audio Jack, 10mm Drivers, Phone/Tablet Compatible(Blue)",Audio,159.0,397.5,60,3.5,57110,151.05,1.05,156493,ZEBRONICS,0.0,0.7,0.0,0.5,0.0,22.0126,93.8958,774.0,0.2054263565891473,153.7826086956522,1.03392705682782,199885.0,5.71374154842396,0.0,,
"OnePlus Bullets Z2 Bluetooth Wireless in Ear Earphones with Mic, Bombastic Bass - 12.4 Mm Drivers, 10 Mins Charge - 20 Hrs Music, 30 Hrs Battery Life (Jazz Green)",Audio,1299.0,2278.95,43,4.1,186412,1234.05,1.05,650765,OnePlus,0.0,0.7,2.0,0.5,0.0,3.1563,279.829,774.0,1.678294573643411,1341.857142857143,0.9680613222612584,764289.2,4.094848109703838,0.0,,
"Mivi SuperPods Immersio [Flagship Launch], Dolby Audio,True Wireless Earbuds, 3D Soundstage, 60H Playtime, AI ENC, BT v5.4 Earbuds",Audio,2199.0,6467.65,66,4.0,3806,2089.05,1.05,10155,Mivi,0.0,0.7,2.0,0.5,0.0,1.819,6.7023,774.0,2.8410852713178296,2132.3333333333335,1.0312646553071751,15224.0,6.285115703266356,0.0,,
"soundcore R50I NC by Anker Noise Cancelling in Ear Earbuds,Strong 42Db Adaptive Noise Cancelling,Powerful Bass,45H Playtime,2-in-1 Case and Phone Stand,Ip54,Fast Charge 10Min = 120 Min,Bluetooth 5.4",Audio,2399.0,5579.07,57,4.0,4630,2279.05,1.05,15059,Noise,0.0,0.7,2.0,0.5,0.0,1.6674,8.5836,774.0,3.099483204134367,1505.060606060606,1.5939557452634547,18520.0,5.428054471002762,0.0,,
"Logitech Pebble Keys 2 K380s, Multi-Device Bluetooth Wireless Keyboard with Customisable Shortcuts, Slim and Portable, Easy-Switch for Windows, macOS, iPadOS, Android, Chrome OS - Tonal Graphite",Computers,2995.0,4218.31,29,4.4,586,2419.54,1.24,3781,Logitech,0.0,0.9,2.0,0.5,0.0,1.4691,1.0965,949.0,3.15595363540569,1487.9333333333334,2.0128589990590977,2578.4,2.338521087009112,0.0,,
"HP K100 Wired Keyboard, Quick, Comfy and Accurate, USB Plug & Play Setup,LED Indicators(7J4G1AA)",Computers,649.0,1248.08,48,4.1,236,616.55,1.05,1140,HP,1.0,0.9,1.0,0.5,0.0,6.3174,0.5472,949.0,0.6838777660695469,595.4285714285714,1.0899712092130518,967.5999999999999,4.570993238739168,0.9,,
Zebronics ZEB-KM2100 Multimedia USB Keyboard Comes with 114 Keys Including 12 Dedicated Multimedia Keys & with Rupee Key,Computers,248.0,400.0,38,3.7,40836,191.25,1.3,161275,Zebronics,0.0,0.9,0.0,0.5,0.0,14.9194,61.2845,949.0,0.2613277133825079,522.2692307692307,0.4748508726710362,151093.2,2.9228520883009,0.0,,
"Dell KB216-Black Multimedia Wired Keyboard with USB Interface, Plunger Keys Technology and Chiclet Key Style, Hot Key-Volume, Mute, Play/Pause, Backward, Forward, Warranty 3 Years",Computers,569.0,646.59,12,4.3,37516,298.02,1.91,165028,Dell,1.0,0.9,0.0,0.5,0.0,7.5571,19.8034,949.0,0.5995785036880927,1595.6666666666667,0.3565907666597033,161318.8,0.6282393591958536,0.9,,
"Zebronics K24 Wired USB Keyboard, 104 Keys, Long Life 8 Million Keystrokes, Silent & Comfortable Use, Slim Design, Retractable Stand, 1.5 Meter Textured Cable, UV Coated keycaps",Computers,299.0,808.11,63,3.7,3366,284.05,1.05,16027,Zebronics,0.0,0.9,0.0,0.5,0.0,12.3746,10.097,949.0,0.3150684931506849,522.2692307692307,0.5725016569703218,12454.2,5.999428625845158,0.0,,
"Kreo Hive Wired Full Size RGB Backlight Gaming Mechanical Keyboard, Customizable RGB, Mechanical Switches, NKRO, Metal Volume Knob, All Black Keycaps (All Black, Red Switch)",Computers,3199.0,6035.85,47,4.2,155,2739.85,1.17,701,Kreo,0.0,0.9,2.0,0.5,0.0,1.3129,0.3295,949.0,3.3709167544783982,4443.909090909091,0.7198617106151423,651.0,4.016750705067944,0.0,,
"Ant Esports MK700 V2 Membrane TKL Wired Gaming Keyboard, 87 UV Coated Mechanical feel Keys Cool RGB Backlight Waterproof Keyboard for PC Laptop Mobile Tablets Gaming, Design and Work Mercury White",Computers,579.0,1996.55,71,4.0,114,550.05,1.05,655,Ant,0.0,0.9,0.0,0.5,0.0,6.9085,0.465,949.0,0.6101159114857745,632.5714285714286,0.9153116531165312,456.0,6.761260832301686,0.0,,
"Zebronics USB Keyboard with Rupee Key, USB Interface and Retractable Stand - K20",Computers,299.0,325.0,8,3.8,2689,177.35,1.69,14738,Zebronics,0.0,0.9,0.0,0.5,0.0,12.709,1.179,949.0,0.3150684931506849,522.2692307692307,0.5725016569703218,10218.199999999999,0.47334477249866874,0.0,,
"Dell KM3322W Wireless USB Keyboard and Mouse Combo, Anti-Fade & Spill-Resistant Keys, up to 36 Month Battery Life, 3Y Advance Exchange Warranty - Black",Computers,1399.0,2498.21,44,4.1,11840,1329.05,1.05,43394,Dell,1.0,0.9,2.0,0.5,0.0,2.9307,19.0934,949.0,1.4741833508956796,1595.6666666666667,0.876749529977021,48543.99999999999,4.190077135510904,0.9,,
"Portronics Ki-Pad 3 USB Wired Keyboard with Large Keycaps, Noise-Free Typing, Fn Multimedia Hotkeys, Full-Size Layout with Num Pad, Ergonomic Design, 1.5m USB Cable, for Laptop, PC, Mac (Pink)",Computers,499.0,998.0,50,4.1,563,474.05,1.05,3227,Noise,0.0,0.9,0.0,0.5,0.0,8.2164,1.6135,949.0,0.5258166491043204,1619.0,0.3082149474984558,2308.2999999999997,4.7614512903533,0.0,,
"Zebronics Transformer Gaming Keyboard and Mouse Combo,Braided Cable,Durable Al body,Multimedia keys and Gaming Mouse with 6 Buttons, Multi-Color LED Lights, High-Resolution Sensor with 3200 DPI(Black)",Computers,1159.0,2414.58,52,4.2,33575,1101.05,1.05,175322,Zebronics,0.0,0.9,1.0,0.5,0.0,3.6238,91.1674,949.0,1.2212855637513171,522.2692307692307,2.219161941232786,141015.0,4.951909341967432,0.0,,
