"D-Link 20W Dual Port Fast Charger Type-C & USB-A for All Mobiles Phones, Tablets, Power Banks, Smart Watches, Earbuds Etc. Bis Certified, Compact Size & Easy to Carry. - White",Mobile Accessories,399.0,1900.0,79,3.9,166,1140.0,0.35,8300,,,,,,,,,599.0,0.666110183639399,,,647.4,22.564981433876035,,,
"Kratos T2 65W Fast Charger Adapter&USB to Type C Cable Combo (White) Compatible for OnePlus, Realme, Xiaomi, Redmi,Vivo and Oppo Mobiles, Dash,Warp, Vooc, Supervooc All Protocols Supported",Mobile Accessories,599.0,1996.67,70,3.8,314,1198.0,0.5,15700,,,,,,,,,599.0,1.0,,,1193.2,13.997200559888022,,,
"Ambrane 25W Type-C Mobile Charger Adapter with Type-C to Type-C Charging Cable | Fast Charging for Samsung Smartphones, iPhone 15/14/13/12/11/X & Pro Series & Other Type-C Devices (Charge 25, Black)",Mobile Accessories,745.0,1405.66,47,4.5,178,843.4,0.88,8900,,,,,,,,,599.0,1.2437395659432386,,,801.0,5.340302238382002,,,
Portronics Adapto 62 POR-1062 USB Wall Adapter with 2.4A Fast Charging Single USB Port Without Cable for All iOS & Android Devices (White),Mobile Accessories,169.0,402.38,58,3.9,6101,241.43,0.7,305050,,,,,,,,,599.0,0.2821368948247078,,,23793.899999999998,8.284530781316954,,,
"Ambrane 30W Dual Port GaN Charger with Type-C to Type-C Cable | USB & Type-C Ports with QC & PD Technology | Fast Charging for iPhone, iPad, Google Pixel, Samsung, Redmi, Mi, Oppo (Charge 30, Black)",Mobile Accessories,955.0,1989.58,52,4.0,97,1193.75,0.8,4850,,,,,,,,,599.0,1.59432387312187,,,388.0,6.4991876015498065,,,
"SUPERVOOC 80W Power Adapter-Ultra Fast Charger for OnePlus with True 80W PD Charging|Compatible with OnePlus 12/12R/11/11R/10/10R,Nord CE3 Lite 5G,Nord2T 5G,Nord CE 2Lite 5G,Nord 5G by AILKIN",Mobile Accessories,599.0,2995.0,80,4.3,1217,1797.0,0.33,60850,,,,,,,,,599.0,1.0,,,5233.099999999999,24.23508027870342,,,
"Redmi Watch 5 Active, 2"" Display, Metal Body, 18 Day Battery, Bluetooth Calling, Advanced AI Noise Cancellation, Alexa, Silver",Smartwatches,2799.0,4998.21,44,4.0,232,1679.4,1.67,930,,,,,,,,,,,,,928.0,2.6345727800730496,,,
"Noise Pulse Go Buzz Smart Watch with Advanced Bluetooth Calling, 1.69"" TFT Display, SpO2, 100 Sports Mode with Auto Detection, Upto 7 Days Battery (2 Days with Heavy Calling) - Jet Black",Smartwatches,1099.0,4995.45,78,4.1,17874,659.4,1.67,74583,,,,,,,,,,,,,73283.4,4.670379019220406,,,
"Noise Pulse 2 Max 1.85"" Display, Bluetooth Calling Smart Watch, 10 Days Battery, 550 NITS Brightness, Smart DND, 100 Sports Modes, Smartwatch for Men and Women (Jet Black)",Smartwatches,1189.0,5945.0,80,4.0,15804,713.4,1.67,57187,,,,,,,,,,,,,63216.0,4.790132327405544,,,
"Noise Newly Launched Quad Call 1.81"" Display, Bluetooth Calling Smart Watch, AI Voice Assistance, 160+Hrs Battery Life, Metallic Build, in-Built Games, 100 Sports Modes, 100+ Watch Faces (Jet Black)",Smartwatches,1099.0,6105.56,82,3.9,2889,659.4,1.67,14114,,,,,,,,,,,,,11267.1,4.909885635590683,,,
"Noise Twist Go Round dial Smartwatch with BT Calling, 1.39"" Display, Metal Build, 100+ Watch Faces, IP68, Sleep Tracking, 100+ Sports Modes, 24/7 Heart Rate Monitoring (Rose Pink)",Smartwatches,1399.0,4996.43,72,4.0,16202,839.4,1.67,61060,,,,,,,,,,,,,64808.0,4.31111909466499,,,
"boAt Lunar Discovery w/ 1.39"" (3.5 cm) HD Display, Turn-by-Turn Navigation, DIY Watch Face Studio, Bluetooth Calling, Emergency SOS, QR Tray, Smart Watch for Men & Women(Active Black)",Smartwatches,1499.0,8327.78,82,4.0,21666,899.4,1.67,97770,,,,,,,,,,,,,86664.0,4.909885635590683,,,
"Fastrack Limitless Glide Smart Watch, Advanced UltraVU HD Display, SingleSync BT Calling, Advance Chipset, 85+ Sports Modes & Smartwatch Faces, AI Voice Assistant, 24 * 7 Health Suite, IP67 (Black)",Smartwatches,1399.0,2798.0,50,3.8,3313,839.4,1.67,14251,,,,,,,,,,,,,12589.4,2.993832704628465,,,
"Boult Newly Launched Rover Pro Smart Watch 1.43'' AMOLED, Bluetooth Calling, IP68, Zinc Alloy Frame, 1000 Nits Brightness, AI Voice Assistant, SpO2 Monitoring, 120+ Sports Mode Smartwatch (Ash Black)",Smartwatches,1599.0,9993.75,84,4.0,266,959.4,1.67,1253,,,,,,,,,,,,,1064.0,5.029638943775821,,,
"Noise Twist Round dial Smart Watch with Bluetooth Calling, 1.38"" TFT Display, up-to 7 Days Battery, 100+ Watch Faces, IP68, Heart Rate Monitor, Sleep Tracking (Jet Black)",Smartwatches,1399.0,4996.43,72,4.0,16202,839.4,1.67,64160,,,,,,,,,,,,,64808.0,4.31111909466499,,,
"boAt Wave Sigma 3 w/Turn-by-Turn Navigation, 2.01"" HD Display, Bluetooth Calling, Crest+ OS, QR Tray, Watch Face Studio, Coins, Emergency SOS Smart Watch for Men & Women(Active Black)",Smartwatches,1499.0,8817.65,83,3.9,22522,899.4,1.67,101942,,,,,,,,,,,,,87835.8,4.969762289683253,,,
"Boult Newly Launched Crown Smart Watch 1.95'' Display, Bluetooth Calling, Working Crown, Zinc Alloy Frame, 900 Nits Brightness, AI Voice Assistant, SpO2 Monitoring, 100+ Sports Mode (Orange)",Smartwatches,1299.0,4479.31,71,4.0,263,779.4,1.67,956,,,,,,,,,,,,,1052.0,4.251242440572421,,,
"Boult Newly Launched Crown Smart Watch 1.95'' Display, Bluetooth Calling, Working Crown, Zinc Alloy Frame, 900 Nits Brightness, AI Voice Assistant, SpO2 Monitoring, 100+ Sports Mode (Black)",Smartwatches,1199.0,4440.74,73,4.0,263,719.4,1.67,1043,,,,,,,,,,,,,1052.0,4.37099574875756,,,
"Boult Drift+ Smart Watch 1.85''HD Screen, Bluetooth Calling, IP68, 500 Nits Brightness,150+ Watchfaces, AI Voice Assistant, SpO2 Monitoring, 100+ Sports Mode Smartwatch (Jet Black)",Smartwatches,1099.0,8453.85,87,4.3,411,659.4,1.67,2025,,,,,,,,,,,,,1767.3,5.20926890605353,,,
"ANDOROCK Best Boost Ultra Orange Smart Watch Display, Bluetooth Calling HD Smart Smartwatch (Multicolour Free Size) (Black, 1.83)",Smartwatches,649.0,998.46,35,3.0,2,599.08,1.08,8,,,,,,,,,,,,,6.0,3.240440699935191,,,
"Boult Trail Smart Watch 2.01'' 3D Curved HD Display, BT Calling, Working Crown, 190+Watchfaces, 500 Nits Brightness, AI Voice Assistant, SpO2 Monitoring, 120+ Sports Mode (Raven Black)",Smartwatches,1299.0,6836.84,81,4.2,538,779.4,1.67,2440,,,,,,,,,,,,,2259.6,4.850008981498114,,,
"boAt Storm Call 3 w/TBT Navigation, Daily Activity Tracker, DIY Watch Face Studio,700+ Active Modes, 1.83"" (4.6 cm) HD Display Fitness Smart Watch for Men & Women(Dark Blue)",Smartwatches,1399.0,8743.75,84,4.1,32413,839.4,1.67,161850,,,,,,,,,,,,,132893.3,5.029638943775821,,,
"Bouncefit D20 Y68 Fitness Band Smart Watch for Men, Women, Boys, Girls, Kids – Single Touch Interface, Water Resistant, Workout Modes, Quick Charge Sports Smartwatch – Pink",Smartwatches,488.0,3050.0,84,3.5,3069,292.8,1.67,11008,,,,,,,,,,,,,10741.5,5.029638943775821,,,
"M I D116 Fitness Band Smart Watch for Men, Women, Boys, Girls, Kids – Single Touch Interface, Water Resistant, Workout Modes, Quick Charge Sports Smartwatch – Black",Smartwatches,449.0,2993.33,85,3.8,1156,269.4,1.67,4138,,,,,,,,,,,,,4392.8,5.089515597868391,,,
"M I D116 Fitness Band Smart Watch for Men, Women, Boys, Girls, Kids – Single Touch Interface, Water Resistant, Workout Modes,Quick Charge Sports Smartwatch – Black I",Smartwatches,449.0,2993.33,85,3.9,682,269.4,1.67,3405,,,,,,,,,,,,,2659.7999999999997,5.089515597868391,,,
"Titan Zeal Premium Fashion Smartwatch|1.85"" AMOLED Display with AOD|390 * 450 Pixel Resolution|Functional Crown|SingleSync BT Calling|Advanced Chipset|100+ Sports Modes & Watchfaces IP68 (Mesh Strap)",Smartwatches,3999.0,13789.66,71,3.7,1592,2399.4,1.67,7952,,,,,,,,,,,,,5890.400000000001,4.251242440572421,,,
"Fire-Boltt Dominian 36.3mm (1.43 inch) AMOLED Display, Stainless Steel Design, 466 * 466 px Resolution, Bluetooth Calling, Multiple Sports Modes, Health Mode, IP67, Weather Updates (Golld Black)",Smartwatches,2299.0,20900.0,89,4.0,968,1379.4,1.67,4031,,,,,,,,,,,,,3872.0,5.329022214238668,,,
"Fastrack New Astor FS1 PRO Smart Watch, Large Super AMOLED Display (1.97"") AOD, AI Voice Assistance, Functional Crown, SingleSync BT Calling, 100+ Sports Modes & Smartwatch Faces, IP68 (Black)",Smartwatches,2399.0,4997.92,52,4.0,7027,1439.4,1.67,30795,,,,,,,,,,,,,28108.0,3.1135860128136037,,,
"Gabit Smart Ring | Health & Fitness Tracker | Stress & Sleep Monitoring | Buy Ring Sizing Kit First | 15+ Workout Modes | Track Steps, HRV, HR, SPO2 | Smart Ring for Men & Women | Matte Black 7",Smartwatches,13110.0,13800.0,5,3.8,39,8280.0,1.58,186,,,,,,,,,,,,,148.2,0.3164356686285678,,,
"Seagate Expansion 1TB External HDD - USB 3.0 for Windows and Mac with 3 yr Data Recovery Services, Portable Hard Drive (STKM1000400)",Computers,5249.0,6033.33,13,4.4,30308,2827.24,1.86,283578,,,,,,,,,949.0,5.531085353003161,,,133355.2,0.6988871566044835,,,
Seagate Portable 1TB External HDD USB 3.0 for PC Laptop and Mac (STGX1000400),Computers,5249.0,6998.67,25,4.4,40414,3141.51,1.67,274983,,,,,,,,,949.0,5.531085353003161,,,177821.6,1.4969163523142326,,,
"Seagate Expansion 1TB External HDD - USB 3.0 for Windows and Mac with 3 yr Data Recovery Services, Portable Hard Drive (STKM1000400)",Computers,5249.0,6033.33,13,4.4,30308,3170.17,1.66,162056,,,,,,,,,949.0,5.531085353003161,,,133355.2,0.7830853563038371,,,
"KINGSTER 2.5"" Ultra Slim 1TB Portable External Hard Drive HDD-USB 3.0 for PC, Mac, Laptop Portable Hard Disk Drive (1TB-MT-Gray)",Computers,2890.0,4587.3,37,3.0,170,2745.5,1.05,1400,,,,,,,,,949.0,3.045310853530032,,,510.0,3.523473954861442,,,
"Sandisk 1TB Portable SSD, 800MB/s R, USB 3.2 Gen 2, Rugged SSD with Upto 2 Meter Drop Protection, Type-C to Type-A Cable, PC & Mac Compatible, 3 Y Warranty, External SSD (SDSSDE30-1T00-G26)",Computers,6999.0,11473.77,39,4.3,5315,6196.62,1.13,29288,,,,,,,,,949.0,7.375131717597471,,,22854.5,3.451022033448368,,,
"Seagate One Touch 5TB External HDD with Password Protection – Black, for Windows and Mac, with 3 yr Data Recovery Services, and 6 Months Mylio Create Plan and Dropbox Backup Plan (STKZ5000400)",Computers,12499.0,18114.49,31,4.4,1012,9352.3,1.34,5780,,,,,,,,,949.0,13.170706006322444,,,4452.8,2.313260204462354,,,
"CARE CASE 1tb Portable External Hard Disk - USB 3.0 for PC Laptop Windows and Mac, 1 Year Warranty, External HDD - Black (1 tb)",Computers,2349.0,6023.08,61,3.3,19,2199.26,1.07,161,,,,,,,,,949.0,2.475237091675448,,,62.699999999999996,5.700401831604522,,,
"Western Digital WD 1TB My Passport Portable Hard Disk Drive, USB 3.0 with Automatic Backup, 256 Bit AES Hardware Encryption,Password Protection,Compatible with Windows and Mac, External HDD-Black",Computers,5749.0,8097.18,29,4.5,16250,5461.55,1.05,90374,,,,,,,,,949.0,6.05795574288725,,,73125.0,2.761641748404914,,,
Seagate Portable 1TB External HDD USB 3.0 for PC Laptop and Mac (STGX1000400),Computers,5249.0,6998.67,25,4.4,40414,2987.85,1.76,263270,,,,,,,,,949.0,5.531085353003161,,,177821.6,1.4203738423953183,,,
CARE CASE 1 TB Portable External Hard Disk Drive - 1TB - 1 Year Warranty - USB 3.0 for PC Laptop Windows Mac Xbox PlayStation - High Performance External HDD - Black (1TB),Computers,2249.0,4016.07,44,3.54348003467078,0,1246.79,1.8,30,,,,,,,,,949.0,2.3698630136986303,,,0.0,2.444308649519471,,,
"Seagate One Touch 2Tb External HDD with Password Protection Black, for Windows and Mac, with 3 Yr Data Recovery Services (Stky2000400), USB",Computers,7449.0,10954.41,32,4.4,5013,5340.37,1.39,35718,,,,,,,,,949.0,7.8493150684931505,,,22057.2,2.301992662398389,,,
"Seagate One Touch 2TB External HDD with Password Protection – Light Blue, for Windows and Mac, with 3 yr Data Recovery Services, and 6 Months Mylio Create Plan and Dropbox Backup Plan (STKY2000402)",Computers,7449.0,10954.41,32,4.4,2813,5015.02,1.49,18359,,,,,,,,,949.0,7.8493150684931505,,,12377.2,2.147506878732971,,,
"TOSHIBA Canvio Advance 1TB Portable External HDD, USB3.0 for PC Laptop Windows and Mac. 3 Years Warranty. External Hard Drive - Red",Computers,5299.0,7160.81,26,4.3,2194,4082.93,1.3,12047,,,,,,,,,949.0,5.5837723919915705,,,9434.199999999999,1.9998461656795632,,,
"TOSHIBA Canvio Ready 1TB Portable External HDD - USB3.0 for PC Laptop Windows and Mac, 3 Years Warranty, External Hard Drive - Black",Computers,5099.0,6890.54,26,4.3,918,2610.17,1.95,8096,,,,,,,,,949.0,5.373024236037935,,,3947.3999999999996,1.3332649607712423,,,
"Seagate One Touch 1TB External HDD with Password Protection – Light Blue, for Windows and Mac, with 3 yr Data Recovery Services, and 6 Months Mylio Create Plan and Dropbox Backup Plan (STKY1000402)",Computers,5699.0,8026.76,29,4.4,1256,3284.62,1.74,7369,,,,,,,,,949.0,6.005268703898841,,,5526.400000000001,1.6665708867306477,,,
"Western Digital WD 1TB Elements Portable Hard Disk Drive, USB 3.0, Compatible with PC, PS4 and Xbox, External HDD (WDBHHG0010BBK-EESN)",Computers,5599.0,7367.11,24,4.4,4673,3555.02,1.57,37686,,,,,,,,,949.0,5.899894625922023,,,20561.2,1.528565059550347,,,
"Sandisk Extreme Portable 1TB, 1050MB/s R, 1000MB/s W, 3mtr Drop Protection, IP65 Water/dust Resistance, HW Encryption, PC,MAC & TypeC Smartphone Compatible, 5Y Warranty, External SSD, Black Color",Computers,9499.0,14842.19,36,4.4,79329,9024.05,1.05,434375,,,,,,,,,949.0,10.009483667017914,,,349047.60000000003,3.428244929054376,,,
"Seagate One Touch 1TB External HDD with Password Protection – Black, for Windows and Mac, with 3 yr Data Recovery Services, and 6 Months Mylio Create Plan and Dropbox Backup Plan (STKY1000400)",Computers,5699.0,6332.22,10,4.4,1364,4158.04,1.37,7191,,,,,,,,,949.0,6.005268703898841,,,6001.6,0.7298737318443909,,,
"KINGSTER'S 2.5"" Ultra Slim Portable External Hard Drive 1TB - USB 3.0 High-Speed Data Storage for PC, Mac, Laptop, Gaming Console, Windows/Linux/Android",Computers,2890.0,5897.96,51,3.3,5,2745.5,1.05,25,,,,,,,,,949.0,3.045310853530032,,,16.5,4.856680316160366,,,
"KINGSTER 1 TB Internal Hard Drive HDD 2.5 Inch SATA 6 Gb/s,5400 RPM,128MB Cache for Laptop,Computer",Computers,2050.0,4456.52,54,3.4,71,1838.49,1.12,631,,,,,,,,,949.0,2.1601685985247627,,,241.4,4.820998125167396,,,
KINGSTER Portable External HDD - 500 GB - 1 Year Warranty - USB 3.0 for PC Laptop Windows Mac Portable Hard Disk Drive - High Speed Hard Disk Drive,Computers,1650.0,6875.0,76,3.0,170,1567.5,1.05,871,,,,,,,,,949.0,1.7386722866174922,,,510.0,7.237405961337016,,,
"Seagate One Touch 2TB External HDD with Password Protection – Silver, for Windows and Mac, with 3 yr Data Recovery Services, and 6 Months Mylio Create Plan and Dropbox Backup Plan (STKY2000401)",Computers,7449.0,10954.41,32,4.3,280,5987.84,1.24,2365,,,,,,,,,949.0,7.8493150684931505,,,1204.0,2.580437061527296,,,
"Bestor 4-Port USB 3.0 Hub, Rotatable 90°/180° USB Splitter with 3 USB Ports & 1 USB-C Power/Data Port, USB Extender for Laptop, MacBook, iMac, Mac Pro, and More",Computers,325.0,1477.27,78,4.1,212,308.75,1.05,2060,,,,,,,,,949.0,0.3424657534246575,,,869.1999999999999,7.427864012951148,,,
"Logitech Brio 100 Full HD Webcam for Meetings and Streaming, Auto-Light Balance, Built-in Mic, Privacy Shutter, USB-A, for Microsoft Teams, Google Meet, Zoom and More- Graphite",Computers,3295.0,3876.47,15,4.2,23447,1619.72,2.03,228112,,,,,,,,,949.0,3.472075869336144,,,98477.40000000001,0.7388798581350673,,,
"Kreo Owl Full HD 1080P 60 FPS Webcam with Auto-Focus and Built-in Dual Digital Mic, Plug and Play Setup for Video Call, Streaming, YouTube and More, Built-in Privacy Shutter with 360 Rotation",Computers,3799.0,4998.68,24,4.4,455,1842.21,2.06,3815,,,,,,,,,949.0,4.003161222339305,,,2002.0000000000002,1.1649919906800639,,,
"Zebronics Zeb-Crystal Clear Web Camera with 3P Lens,Built-in Microphone,Auto White Balance,Night Vision and Manual Switch for LED (Black)",Computers,699.0,1294.44,46,3.3,10343,576.97,1.21,78080,,,,,,,,,949.0,0.7365648050579557,,,34131.9,3.8013387323361707,,,
"Logitech C270 Digital HD Webcam with Widescreen HD Video Calling, HD Light Correction, Noise-Reducing Mic, for Skype, FaceTime, Hangouts, WebEx, PC/Mac/Laptop/MacBook/Tablet - (Black, HD 720p/30fps)",Computers,1995.0,2695.95,26,4.2,23447,1408.57,1.42,198502,,,,,,,,,949.0,2.102212855637513,,,98477.40000000001,1.830856981902683,,,
"Logitech Brio 100 Full HD Webcam for Meetings and Streaming, Auto-Light Balance, Built-in Mic, Privacy Shutter, USB-A, for Microsoft Teams, Google Meet, Zoom and More- Graphite",Computers,3295.0,3876.47,15,4.2,23447,2466.74,1.34,118462,,,,,,,,,949.0,3.472075869336144,,,98477.40000000001,1.1193194537721065,,,
"Lenovo 300 FHD Webcam with Full Stereo Dual Built-in mics | FHD 1080P 2.1 Megapixel CMOS Camera |Ultra-Wide 95° Lens, 4X Digital Zoom | 360 Rotation | Flexible Mount | Cloud Grey",Computers,2799.0,4998.21,44,4.0,13415,2459.79,1.14,91920,,,,,,,,,949.0,2.949420442571128,,,53660.0,3.859310586790633,,,
"LAPCARE Lapcam HD 720 P, Noise Isolated Microphone with Computer HD stremaing Web cam for Desktop & Laptop with mic with Wide Angle Lens & Large Sensor for Superior Low Light, Optical (Black)",Computers,929.0,2732.35,66,3.4,1182,869.67,1.07,10380,,,,,,,,,949.0,0.9789251844046364,,,4018.7999999999997,6.167647883375385,,,
"1080P Webcam with Microphone, eMeet C960 Web Camera, 2 Mics Streaming Webcam with Privacy Cover, 90°View Computer Camera, Plug&Play USB Webcam for Calls/Conference, Zoom/Skype/YouTube, Laptop/Desktop",Computers,2999.0,7892.11,62,4.3,27235,2849.05,1.05,204121,,,,,,,,,949.0,3.1601685985247627,,,117110.5,5.904199600038092,,,
"eMeet 1080P Webcam - USB Webcam with Microphone & Physical Privacy Cover, Noise-Canceling Mic, Auto Light Correction, C950 Ultra Compact FHD Web Cam w/ 70°View for Meeting/Online Classes/Zoom/YouTube",Computers,2199.0,4997.73,56,4.3,2024,2089.05,1.05,15715,,,,,,,,,949.0,2.317175974710221,,,8703.199999999999,5.332825445195696,,,
"Zebronics Zeb-Ultimate Pro (Full HD) 1080p/30fps Webcam with 5P Lens, Built-in Mic, Auto White Balance, Night Vision, Manual Switch for LED (Black)",Computers,1399.0,3330.95,58,3.7,6098,1329.05,1.05,56332,,,,,,,,,949.0,1.4741833508956796,,,22562.600000000002,5.523283496809828,,,
"Logitech Brio 300 Full Hd Webcam with Privacy Shutter, Noise Reduction Microphone, USB-C, Certified for Zoom, Microsoft Teams, Google Meet, Auto Light Correction - Off White - Digital",Computers,6469.0,7522.09,14,4.0,67,2306.19,2.81,443,,,,,,,,,949.0,6.816649104320337,,,268.0,0.49820291092843666,,,
"Angetube Streaming Webcam with Microphone: 1080P 60FPS USB Web Cam with Ring Light and Remote Control - HD Web Camera with 5X Digital Zoom Built in Privacy Cover,for PC|Computer|Laptop|Mac|Desktop",Computers,5381.0,8031.34,33,4.3,1755,5111.95,1.05,13310,,,,,,,,,949.0,5.67017913593256,,,7546.5,3.142557851633178,,,
"Kreo Owl Full HD 1080P 60 FPS Webcam with Auto-Focus and Built-in Dual Digital Mic, Plug and Play Setup for Video Call, Streaming, YouTube and More, Built-in Privacy Shutter with 360 Rotation",Computers,3799.0,4998.68,24,4.4,455,3249.87,1.17,3085,,,,,,,,,949.0,4.003161222339305,,,2002.0000000000002,2.0511067430134178,,,
"Zebion Tiger Eye Webcam with Microphone, Auto Focus HD 720P Web Camera for Video Calling Conferencing Recording, PC Laptop Desktop, Online Classes, USB Webcams Play and Plug",Computers,499.0,1386.11,64,2.9,16,422.96,1.18,120,,,,,,,,,949.0,0.5258166491043204,,,46.4,5.4232692144733505,,,
"Logitech Brio 100 Full HD Webcam for Meetings and Streaming, Auto-Light Balance, Built-in Mic, Privacy Shutter, USB-A, for Microsoft Teams, Google Meet, Zoom and More- OffWhite",Computers,3295.0,3876.47,15,4.2,23447,1990.96,1.65,198188,,,,,,,,,949.0,3.472075869336144,,,98477.40000000001,0.9090358160111508,,,
"eMeet S600 4K Webcam for Streaming - Sony 1/2.5'' Sensor, PDAF Autofocus, 1080P@60FPS, 2 Noise Reduction Mics, Built-in Privacy Cover, 40°-73° FOV, Streaming Camera for Live Commerce/Gaming/Beauty",Computers,6499.0,12035.19,46,4.3,27235,5844.93,1.11,145843,,,,,,,,,949.0,6.848261327713383,,,117110.5,4.143770831456625,,,
"Kreo Owl Full HD 1080P 60 FPS Webcam with Auto-Focus and Built-in Dual Digital Mic, Plug and Play Setup for Video Call, Streaming, YouTube and More, Built-in Privacy Shutter with 360 Rotation",Computers,3799.0,4998.68,24,4.4,455,2306.99,1.65,2516,,,,,,,,,949.0,4.003161222339305,,,2002.0000000000002,1.4544573056178411,,,
"FRONTECH Webcam 2255 - HD 720p, Driverless DSP Chip, 4X Digital Zoom - Crystal Clear Video Calls CMOS Sensor|Built-in Mic| LED Lights, 30 FPS, Plug and Play USB Interface, Auto White Balance",Computers,779.0,1589.8,51,2.9,32,731.38,1.07,177,,,,,,,,,949.0,0.8208640674394099,,,92.8,4.765909728062797,,,
"Logitech C920 HD Pro Webcam - 1080p, Optical, Full HD Streaming Camera for Widescreen Video Calling and Recording, Dual Microphones, Autofocus, Compatible with PC - Desktop Computer or Laptop - Black",Computers,7400.0,12982.46,43,4.3,31236,4575.48,1.62,199176,,,,,,,,,949.0,7.79768177028451,,,134314.8,2.6541571507931603,,,
"eMeet C950 4K Webcam for PC - 8 Megapixels 4K UHD, PDAF Autofocus, Noise-Canceling Mic, 70° FOV, 1080P@60FPS, Privacy Cover, USB 2.0 Plug&Play, Ideal PC Camera 4K for Zoom/Teams/Skype/Google Meet",Computers,3999.0,4704.71,15,4.3,27235,2322.71,1.72,229872,,,,,,,,,949.0,4.21390937829294,,,117110.5,0.8720423231207488,,,
"TECHNOVIEW Crisp Pro Digital Zoom 720P Web Camera with 5P HD Quality Lens, CMOS Image Sensor, 24 FPS Video Resolution, Built-in Mic, Auto White Vision, Night Vision and Manual Switch for LED (Black)",Computers,998.0,3024.24,67,4.2,42,948.1,1.05,210,,,,,,,,,949.0,1.0516332982086407,,,176.4,6.380344729073422,,,
"eMeet C950 4K Webcam for PC - 8 Megapixels 4K UHD, PDAF Autofocus, Noise-Canceling Mic, 70° FOV, 1080P@60FPS, Privacy Cover, USB 2.0 Plug&Play, Ideal PC Camera 4K for Zoom/Teams/Skype/Google Meet",Computers,3999.0,4704.71,15,4.3,27235,2890.78,1.38,182524,,,,,,,,,949.0,4.21390937829294,,,117110.5,1.0868777624809798,,,
"CA Essential Webcam Flex (WC-Flex) – Multi-function HD webcam with three mounting positions, Center View for better eye contact, Table View for desktop sharing and Traditional View on top of a monitor",Computers,7884.0,12924.59,39,3.3,36,4840.57,1.63,248,,,,,,,,,949.0,8.307692307692308,,,118.8,2.3924912582050184,,,
"Ambrane 20W Type C Mobile Charger Adapter, Fast Charging for Android, iPhone 15/14/13/12/11/X & Pro, Max Series, Google Pixel & Other Type C Enabled Devices, PD Technology (Charge 20, White)",Mobile Accessories,399.0,906.82,56,4.2,135,379.05,1.05,1592,,,,,,,,,599.0,0.666110183639399,,,567.0,5.332825445195696,,,
"Hammer 65W GaN Fast Charger, iPhone 0 to 60% in 30 mins, Dual USB-C (Type C), Compatible with iPhone 16, 15, 14, 13, 12, MacBook Pro, MacBook Air, iPad, Samsung Mobiles, Made in Vietnam, 2 Yr Warranty",Mobile Accessories,2199.0,5497.5,60,4.4,72,2089.05,1.05,330,,,,,,,,,599.0,3.671118530884808,,,316.8,5.71374154842396,,,
"Portronics Adapto 66 2.4A 12w Dual USB Port 5V/2.4A Wall Charger,Comes with 1M Micro USB Cable, USB Wall Charger Adapter for Smartphone (Black)",Mobile Accessories,199.0,497.5,60,4.0,2494,189.05,1.05,7258,,,,,,,,,599.0,0.332220367278798,,,9976.0,5.71374154842396,,,
"Xykos 80W SUPERVOOC Charger with Type C Cable 100 cm Compatible with OnePlus, Infinix, Realme, Redmi, Nothing, Oppo, & Other Smartphones | C Type Charger Supports Dash,Warp, Vooc, 80 w Charger, White",Mobile Accessories,585.0,2017.24,71,4.3,16184,555.75,1.05,8698,,,,,,,,,599.0,0.976627712854758,,,69591.2,6.761260832301686,,,
"MI Xiaomi 22.5W Fast Charger with USB-C Cable, Quick Charge 3.0 Power Adapter Compatible with Redmi Note Series, Poco, Mi, Any Type C Devices - with Power Delivery (White)",Mobile Accessories,699.0,998.57,30,4.2,37497,564.19,1.24,8487,,,,,,,,,599.0,1.1669449081803005,,,157487.4,2.4191597451818403,,,
"Kratos T2 65W Fast Charger Adapter&USB to Type C Cable Combo (White) Compatible for OnePlus, Realme, Xiaomi, Redmi,Vivo and Oppo Mobiles, Dash,Warp, Vooc, Supervooc All Protocols Supported",Mobile Accessories,599.0,1996.67,70,3.8,314,569.05,1.05,1570,,,,,,,,,599.0,1.0,,,1193.2,6.66603180649462,,,
"Portronics Adapto 12 2.4A 12W Fast Wall Charger for iPhone 11/Xs/XS Max/XR/X/8/7/6/Plus, iPad Pro/Air 2/Mini 3/Mini 4, Samsung S4/S5, and More(White)",Mobile Accessories,169.0,402.38,58,4.1,10385,160.55,1.05,9055,,,,,,,,,599.0,0.2821368948247078,,,42578.49999999999,5.523283496809828,,,
"Fast Type-C Charger for Xiaomi Redmi Note 9 Pro, Note 8, Note 8 pro Note 7 Pro, Note 7S, Note 7, 8A Mi A1, Mi A2, Mi A3 Type -C Mobile Android Charger",Mobile Accessories,309.0,792.31,61,4.0,244,293.55,1.05,1896,,,,,,,,,599.0,0.5158597662771286,,,976.0,5.808970574231026,,,
"Portronics Adapto 45 22.5 W Mobile Charger Adapter with Dual Port (USB A + PD Type C), Fast Charging, Short Circuit Protection, Wide Compatibility (Black)",Mobile Accessories,399.0,997.5,60,3.9,5012,379.05,1.05,8875,,,,,,,,,599.0,0.666110183639399,,,19546.8,5.71374154842396,,,
"Fast Charger for Vivo Y20 / Y 20 vivo v7, v7+, v9, v9 Youth Charger Original Adapter Charger | Mobile Fast Charger | Android USB Charger with 1M Micro USB Charging Data Cable (2.4 Amp, White)",Mobile Accessories,258.0,806.25,68,3.7,29,245.1,1.05,296,,,,,,,,,599.0,0.4307178631051753,,,107.30000000000001,6.475573754880488,,,
"boAt WCDV 22.5W Dual Port Charger with 22.5W Power Delivery Support & 18W Quick Charge 3.0, Smart IC Protection, Auto Detection for Samsung, Xiaomi & Android Users with Type C to Type C Cable(White)",Mobile Accessories,699.0,2496.43,72,4.1,19547,664.05,1.05,9495,,,,,,,,,599.0,1.1669449081803005,,,80142.7,6.856489858108752,,,
"D-Link 20W Dual Port Fast Charger Type-C & USB-A for All Mobiles Phones, Tablets, Power Banks, Smart Watches, Earbuds Etc. Bis Certified, Compact Size & Easy to Carry. - White",Mobile Accessories,425.0,1931.82,78,3.9,167,403.75,1.05,848,,,,,,,,,599.0,0.7095158597662772,,,651.3,7.427864012951148,,,
"Belkin 60W (30w + 30W) Dual USB-C PPS Fast Charging Wall Charger | 2 Meter Power Extender with 4-Port (2 USB-C & 2 USB-A) | Compatible with iPhone 16, 15, 14, 13, 12, iPad, Galaxy S24, Google Pixel",Mobile Accessories,3499.0,6998.0,50,4.3,3650,2125.58,1.65,8029,,,,,,,,,599.0,5.841402337228715,,,15695.0,3.030119386703836,,,
