product_name,category,discounted_price,actual_price,discount_percentage,rating,rating_count,manufacturing_cost,price_to_cost_ratio,estimated_units_sold,brand,brand_tier,category_complexity,price_segment,seasonal_relevance,is_new_release,value_ratio,price_elasticity,category_median_price,price_to_category_median_ratio,brand_avg_price,price_to_brand_avg_ratio,rating_x_count,discount_to_margin_ratio,premium_complexity,Unnamed: 25,Unnamed: 26
"TP-Link USB WiFi Adapter for PC(TL-WN725N), N150 Wireless Network Adapter for Desktop - Nano Size WiFi Dongle Compatible with Windows 11/10/7/8/8.1/XP/ Mac OS 10.9-10.15 Linux Kernel 2.6.18-4.4.3",Computers,499.0,998.0,50,4.2,179691,319.81,1.56,7187640,,,,,,,,,949.0,0.5258166491043204,,,754702.2000000001,3.204922761361451,,,
"Wayona Nylon Braided 3A Lightning to USB A Syncing and Fast Charging Data Cable for iPhone, Ipad (3 FT Pack of 1, Black)",Computers,399.0,1108.33,64,4.2,24269,255.72,1.56,970760,,,,,,,,,949.0,0.4204425711275026,,,101929.8,4.102301134542658,,,
"FLiX (Beetel USB to Micro USB PVC Data Sync & 2A Fast Charging Cable, Made in India, 480Mbps Data Sync, Solid Cable, 1 Meter Long USB Cable for Micro USB Devices (White)(XCD-M11)",Computers,59.0,196.67,70,4.0,9378,37.81,1.56,375120,,,,,,,,,949.0,0.0621707060063224,,,37512.0,4.486891865906031,,,
"Amazon Basics High-Speed HDMI Cable, 6 Feet - Supports Ethernet, 3D, 4K video,Black",Home Entertainment,309.0,475.0,35,4.4,426973,198.59,1.56,21348650,,,,,,,,,,,,,1878681.2000000002,2.2434459329530156,,,
7SEVEN® Compatible for Samsung Smart 4K Ultra HD TV Monitor Remote Control Replacement of Original Samsung TV Remote for LED OLED UHD QLED and Suitable for 6 7 8 Series Samsung TV with Hot Keys BN59-01259E,Home Entertainment,399.0,997.5,60,3.6,493,256.43,1.56,24650,,,,,,,,,,,,,1774.8,3.845907313633741,,,
"AmazonBasics Micro USB Fast Charging Cable for Android Phones with Gold Plated Connectors (3 Feet, Black)",Computers,179.0,497.22,64,4.2,92595,114.72,1.56,3703800,,,,,,,,,949.0,0.1886195995785037,,,388899.0,4.102301134542658,,,
Tata Sky Universal Remote,Home Entertainment,230.0,500.0,54,3.7,2960,147.82,1.56,148000,,,,,,,,,,,,,10952.0,3.461316582270367,,,
"TP-LINK WiFi Dongle 300 Mbps Mini Wireless Network USB Wi-Fi Adapter for PC Desktop Laptop(Supports Windows 11/10/8.1/8/7/XP, Mac OS 10.9-10.15 and Linux, WPS, Soft AP Mode, USB 2.0) (TL-WN823N),Black",Computers,649.0,1410.87,54,4.2,179691,415.94,1.56,7187640,,,,,,,,,949.0,0.6838777660695469,,,754702.2000000001,3.461316582270367,,,
"Airtel DigitalTV DTH Television, Setup Box Remote Compatible for SD and HD Recording (Black)",Home Entertainment,179.0,813.64,78,3.7,2201,115.04,1.56,110050,,,,,,,,,,,,,8143.700000000001,4.999679507723863,,,
"Amazon Basics High-Speed HDMI Cable, 6 Feet (2-Pack),Black",Home Entertainment,309.0,1404.55,78,4.4,426973,198.59,1.56,21348650,,,,,,,,,,,,,1878681.2000000002,4.999679507723863,,,
"Model-P4 6 Way Swivel Tilt Wall Mount 32-55-inch Full Motion Cantilever for LED,LCD and Plasma TV's",Home Entertainment,1599.0,3016.98,47,4.2,2727,1027.64,1.56,136350,,,,,,,,,,,,,11453.4,3.012627395679764,,,
"Wayona Usb Nylon Braided Data Sync And Charging Cable For Iphone, Ipad Tablet (Red, Black)",Computers,399.0,1108.33,64,4.2,24269,255.72,1.56,970760,,,,,,,,,949.0,0.4204425711275026,,,101929.8,4.102301134542658,,,
"Flix (Beetel) Usb To Type C Pvc Data Sync And 2A 480Mbps Data Sync, Tough Fast Charging Long Cable For Usb Type C Devices, Charging Adapter (White, 1 Meter) - Xcd-C12",Computers,139.0,248.21,44,4.0,9378,89.08,1.56,375120,,,,,,,,,949.0,0.1464699683877766,,,37512.0,2.820332029998077,,,
"boAt A 350 Type C Cable for Smartphone, Charging Adapter (1.5m, Carbon Black)",Computers,299.0,808.11,63,4.4,28791,191.63,1.56,1151640,,,,,,,,,949.0,0.3150684931506849,,,126680.40000000001,4.038202679315428,,,
"Wayona Nylon Braided (2 Pack) Lightning Fast Usb Data Cable Fast Charger Cord For Iphone, Ipad Tablet (3 Ft Pack Of 2, Grey)",Computers,649.0,2028.13,68,4.2,24269,415.94,1.56,970760,,,,,,,,,949.0,0.6838777660695469,,,101929.8,4.358694955451574,,,
"boAt Deuce USB 300 2 in 1 Type-C & Micro USB Stress Resistant, Sturdy Cable with 3A Fast Charging & 480mbps Data Transmission, 10000+ Bends Lifespan and Extended 1.5m Length(Mercurial Black)",Computers,299.0,695.35,57,4.2,94363,191.63,1.56,3774520,,,,,,,,,949.0,0.3150684931506849,,,396324.60000000003,3.6536119479520544,,,
Lapster USB 3.0 A to Micro B SuperSpeed for hard disk cable - short cable,Computers,199.0,995.0,80,4.1,425,127.54,1.56,17000,,,,,,,,,949.0,0.2096944151738672,,,1742.4999999999998,5.127876418178322,,,
"ZEBRONICS ZEB-USB150WF1 WiFi USB Mini Adapter Supports 150 Mbps Wireless Data, Comes with Advanced Security WPA/WPA2 encryption Standards",Computers,290.0,349.0,17,3.7,1977,185.86,1.56,79080,,,,,,,,,949.0,0.3055848261327713,,,7314.900000000001,1.0896737388628934,,,
"LOHAYA Remote Compatible for Mi Smart LED TV 4A Remote Control (32""/43"") [ Compatible for Mi Tv Remote Control ] [ Compatible for Mi Smart LED Tv Remote Control ]",Home Entertainment,249.0,803.23,69,3.8,1079,160.03,1.56,53950,,,,,,,,,,,,,4100.2,4.4227934106788025,,,
"Gilary Multi Charging Cable, 3 in 1 Nylon Braided Fast Charging Cable for iPhone Micro USB Type C Mobile Phone | Colour May Vary |",Computers,345.0,985.71,65,3.7,1097,221.11,1.56,43880,,,,,,,,,949.0,0.3635405690200211,,,4058.9,4.1663995897698864,,,
TP-Link UE300 USB 3.0 to RJ45 Gigabit Ethernet Network Adapter - Plug and Play,Computers,1099.0,1894.83,42,4.5,22420,704.35,1.56,896800,,,,,,,,,949.0,1.1580611169652266,,,100890.0,2.692135119543619,,,
"Wayona Type C to Lightning MFI Certified 20W Fast charging Nylon Braided USB C Cable for iPhone 14, 14 Pro, 14 Pro Max, 14 Plus, 13, 13 Pro, 13 Pro Max, 13 Mini, 12, 12 Pro, 11, 11 Pro Max iPhone 12 Mini, X, 8 (2M, Grey)",Computers,719.0,1497.92,52,4.1,1045,460.81,1.56,41800,,,,,,,,,949.0,0.7576396206533192,,,4284.5,3.333119671815909,,,
Dealfreez Case Compatible with Fire TV Stick 3rd Gen 2021 Full Wrap Silicone Remote Cover Anti-Lost with Loop (D-Black),Home Entertainment,349.0,1517.39,77,4.3,4145,224.29,1.56,207250,,,,,,,,,,,,,17823.5,4.935581052496635,,,
"Amazon Basics New Release Nylon USB-A to Lightning Cable Cord, Fast Charging MFi Certified Charger for Apple iPhone, iPad (3-Ft, Rose Gold)",Computers,849.0,1806.38,53,4.3,6547,544.12,1.56,261880,,,,,,,,,949.0,0.8946259220231823,,,28152.1,3.397218127043138,,,
Isoelite Remote Compatible for Samsung LED/LCD Remote Control Works with All Samsung LED/LCD TV Model No :- BN59-607A (Please Match The Image with Your Old Remote),Home Entertainment,299.0,906.06,67,4.0,1588,192.16,1.56,79400,,,,,,,,,,,,,6352.0,4.294596500224344,,,
"Wayona Nylon Braided USB Data Sync and Fast Charging 3A Short Power Bank Cable For iPhones, iPad Air, iPad mini, iPod Nano and iPod Touch (Grey)",Computers,349.0,997.14,65,4.2,13120,223.67,1.56,524800,,,,,,,,,949.0,0.3677555321390938,,,55104.0,4.1663995897698864,,,
"Wayona Type C To Type C Long Fast Charging Cable Type C Charger Cord Compatible With Samsung S22 S20 S20 Fe 2022 S22 Ultra S21 Ultra A70 A51 A53 A33 A73 M51 M31 M33 M53 (Grey, 2M, 65W, 6Ft)",Computers,399.0,997.5,60,4.3,2806,255.72,1.56,112240,,,,,,,,,949.0,0.4204425711275026,,,12065.8,3.845907313633741,,,
"Wayona Nylon Braided 2M / 6Ft Fast Charge Usb To Lightning Data Sync And Charging Cable For Iphone, Ipad Tablet (6 Ft Pack Of 1, Grey)",Computers,449.0,1282.86,65,4.2,24269,287.76,1.56,970760,,,,,,,,,949.0,0.4731296101159115,,,101929.8,4.1663995897698864,,,
CROSSVOLT Compatible Dash/Warp Data Sync Fast Charging Cable Supported for All C Type Devices (Cable),Computers,299.0,996.67,70,4.3,766,191.63,1.56,30640,,,,,,,,,949.0,0.3150684931506849,,,3293.7999999999997,4.486891865906031,,,
"PTron Solero T241 2.4A Type-C Data & Charging USB Cable, Made in India, 480Mbps Data Sync, Durable 1-Meter Long USB Cable for Type-C USB Devices for Charging Adapter (Black)",Computers,99.0,825.0,88,3.9,24871,63.45,1.56,994840,,,,,,,,,949.0,0.1043203371970495,,,96996.9,5.640664059996154,,,
"boAt Laptop, Smartphone Type-c A400 Male Data Cable (Carbon Black)",Computers,273.1,1011.48,73,4.3,20850,175.03,1.56,834000,,,,,,,,,949.0,0.2877766069546891,,,89655.0,4.6791872315877185,,,
"boAt Type C A750 Stress Resistant, Tangle-free, Sturdy Flat Cable with 6.5A Fast Charging & 480Mbps Data Transmission, 10000+ Bends Lifespan and Extended 1.5m Length(Radiant Red)",Computers,399.0,997.5,60,4.1,1780,255.72,1.56,71200,,,,,,,,,949.0,0.4204425711275026,,,7297.999999999999,3.845907313633741,,,
Cotbolt Silicone Protective Case Cover for LG an MR21GA Magic Remote Shockproof for LG Smart TV Remote 2021 Protective Skin Waterproof Anti Lost (Black) (Remote Not Included),Home Entertainment,399.0,1995.0,80,4.5,505,256.43,1.56,25250,,,,,,,,,,,,,2272.5,5.127876418178322,,,
Portronics Konnect L POR-1403 Fast Charging 3A Type-C Cable 1.2 Meter with Charge & Sync Function for All Type-C Devices (White),Computers,210.0,396.23,47,4.1,1717,134.59,1.56,68680,,,,,,,,,949.0,0.2212855637513171,,,7039.7,3.012627395679764,,,
Electvision Remote Control Compatible with Amazon Fire tv Stick (Pairing Manual Will be Back Side Remote Control)(P),Home Entertainment,1299.0,1999.0,35,3.6,590,834.84,1.56,29500,,,,,,,,,,,,,2124.0,2.2434459329530156,,,
"King Shine Multi Retractable 3.0A Fast Charger Cord, Multiple Charging Cable 4Ft/1.2m 3-in-1 USB Charge Cord Compatible with Phone/Type C/Micro USB for All Android and iOS Smartphones (Random Colour)",Computers,347.0,991.43,65,3.5,1121,222.39,1.56,44840,,,,,,,,,949.0,0.3656480505795574,,,3923.5,4.1663995897698864,,,
"Lapster 5 pin mini usb cable, usb b cable,camera cable usb2.0 for External HDDS/Card Readers/Camera etc.",Computers,149.0,993.33,85,4.0,1313,95.49,1.56,52520,,,,,,,,,949.0,0.1570073761854583,,,5252.0,5.448368694314467,,,
"Portronics Konnect Spydr 31 3-in-1 Multi Functional Cable with 3.0A Output, Tangle Resistant, 1.2M Length, Nylon Braided(Zebra)",Computers,228.0,912.0,75,3.8,132,146.12,1.56,5280,,,,,,,,,949.0,0.2402528977871443,,,501.59999999999997,4.807384142042176,,,
"Belkin Apple Certified Lightning To Type C Cable, Tough Unbreakable Braided Fast Charging For Iphone, Ipad, Air Pods, 3.3 Feet (1 Meters)    White",Computers,1599.0,1999.0,20,4.4,1951,1024.8,1.56,78040,,,,,,,,,949.0,1.6849315068493151,,,8584.400000000001,1.2819691045445805,,,
Remote Control Compatible for Amazon Fire Tv Stick Remote Control [ 3rd Gen ](Not Compatible for Fire TV Edition Smart TV) from basesailor,Home Entertainment,1499.0,4051.35,63,3.7,37,963.38,1.56,1850,,,,,,,,,,,,,136.9,4.038202679315428,,,
AmazonBasics 6-Feet DisplayPort (not USB port) to HDMI Cable Black,Home Entertainment,799.0,1700.0,53,4.1,28638,513.5,1.56,1431900,,,,,,,,,,,,,117415.79999999999,3.397218127043138,,,
AmazonBasics 3 Feet High Speed HDMI Male to Female 2.0 Extension Cable,Home Entertainment,229.0,602.63,62,4.3,12835,147.17,1.56,641750,,,,,,,,,,,,,55190.5,3.974104224088199,,,
7SEVEN® Compatible Lg Smart Tv Remote Suitable for Any LG LED OLED LCD UHD Plasma Android Television and AKB75095303 replacement of Original Lg Tv Remote Control,Home Entertainment,349.0,601.72,42,4.2,284,224.29,1.56,14200,,,,,,,,,,,,,1192.8,2.692135119543619,,,
"AmazonBasics 3.5mm to 2-Male RCA Adapter Cable For Tablet, Smartphone (Black, 15 feet)",Home Entertainment,489.0,1192.68,59,4.4,69538,314.27,1.56,3476900,,,,,,,,,,,,,305967.2,3.7818088584065124,,,
"Wayona Usb Type C 65W 6Ft/2M Long Fast Charging Cable Compatible For Samsung S22 S20 Fe S21 Ultra A33 A53 A01 A73 A70 A51 M33 M53 M51 M31(2M, Black)",Computers,399.0,997.5,60,4.3,2806,255.72,1.56,112240,,,,,,,,,949.0,0.4204425711275026,,,12065.8,3.845907313633741,,,
"Saifsmart Outlet Wall Mount Hanger Holder for Dot 3rd Gen, Compact Bracket Case Plug and Built-in Cable Management for Kitchen Bathroom, Bedroom (Black)",Home Audio,349.0,1292.59,73,4.0,3295,234.26,1.49,164750,,,,,,,,,,,,,13180.0,4.89900006710959,,,
"MI 2-in-1 USB Type C Cable (Micro USB to Type C) 30cm for Smartphone, Headphone, Laptop (White)",Computers,179.0,298.33,40,3.9,81,114.72,1.56,3240,,,,,,,,,949.0,0.1886195995785037,,,315.9,2.563938209089161,,,
"AmazonBasics New Release ABS USB-A to Lightning Cable Cord, Fast Charging MFi Certified Charger for Apple iPhone, iPad Tablet (3-Ft, White)",Computers,689.0,1497.83,54,4.2,42301,441.58,1.56,1692040,,,,,,,,,949.0,0.726027397260274,,,177664.2,3.461316582270367,,,
"pTron Solero 331 3.4Amps Multifunction Fast Charging Cable, 3-in-1 USB Cable Micro USB/Type-C/iOS, Made in India, Durable & Strong & Tangle-free 118cm in Length (Black)",Computers,249.0,922.22,73,3.9,1075,159.58,1.56,43000,,,,,,,,,949.0,0.2623814541622761,,,4192.5,4.6791872315877185,,,
"10k 8k 4k HDMI Cable, Certified 48Gbps 1ms Ultra High Speed HDMI 2.1 Cable 4k 120Hz 144Hz 2k 165Hz 8k 60Hz Dynamic HDR ARC eARC DTS:X Compatible for Mac Gaming PC Soundbar TV Monitor Laptop PS5 4 Xbox",Home Entertainment,999.0,2378.57,58,4.6,3664,642.04,1.56,183200,,,,,,,,,,,,,16854.399999999998,3.717710403179283,,,
LRIPL Compatible Sony Bravia LCD/led Remote Works with Almost All Sony led/LCD tv's,Home Entertainment,399.0,399.0,0,3.9,1951,256.43,1.56,97550,,,,,,,,,,,,,7608.9,0.0,,,
"boAt Type-c A400 Type-c to USB A Cable for All Type C Phones (Lg nexus 5x), 1Mtr(Black)",Computers,349.0,698.0,50,4.3,20850,223.67,1.56,834000,,,,,,,,,949.0,0.3677555321390938,,,89655.0,3.204922761361451,,,
"Zoul Type C to Type C Fast Charging Cable 65W 2M/6ft USB C Nylon Braided Cord Compatible with MacBook Oneplus 9 9R Samsung Galaxy S21 Ultra S20+ (2M, Black)",Computers,399.0,1108.33,64,4.1,2685,255.72,1.56,107400,,,,,,,,,949.0,0.4204425711275026,,,11008.499999999998,4.102301134542658,,,
"TP-LINK AC1300 Archer T3U Plus High Gain USB 3.0 Wi-Fi Dongle, Wireless Dual Band MU-MIMO WiFi Adapter with High Gain Antenna, Supports Windows 11/10/8.1/8/7/XP/MacOS",Computers,1699.0,2980.7,43,4.4,24780,1088.89,1.56,991200,,,,,,,,,949.0,1.790305584826133,,,109032.00000000001,2.7562335747708477,,,
"LRIPL Mi Remote Control with Netflix & Prime Video Button Compatible for Mi 4X LED Android Smart TV 4A Remote Control (32""/43"") with Voice Command (Pairing Required)",Home Entertainment,655.0,1091.67,40,3.2,285,420.95,1.56,14250,,,,,,,,,,,,,912.0,2.563938209089161,,,
"TP-Link Nano USB WiFi Dongle 150Mbps High Gain Wireless Network Wi-Fi Adapter for PC Desktop and Laptops, Supports Windows 10/8.1/8/7/XP, Linux, Mac OS X (TL-WN722N)",Computers,749.0,1337.5,44,4.2,179692,480.03,1.56,7187680,,,,,,,,,949.0,0.7892518440463646,,,754706.4,2.820332029998077,,,
Airtel DigitalTV DTH Remote SD/HD/HD Recording Compatible for Television (Shining Black ),Home Entertainment,195.0,500.0,61,3.7,1383,125.32,1.56,69150,,,,,,,,,,,,,5117.1,3.9100057688609704,,,
"AmazonBasics New Release Nylon USB-A to Lightning Cable Cord, MFi Certified Charger for Apple iPhone, iPad, Silver, 6-Ft",Computers,999.0,2081.25,52,4.5,5492,640.26,1.56,219680,,,,,,,,,949.0,1.0526870389884089,,,24714.0,3.333119671815909,,,
"Ambrane Fast 100W Output Cable with Type-C to Type-C for Mobile, Laptop, Macbook & Table Charging, 480mbps Data Sync Speed, Braided Cable, 1.5m Length (ABCC-100, Black-Grey)",Computers,499.0,891.07,44,4.2,919,319.81,1.56,36760,,,,,,,,,949.0,0.5258166491043204,,,3859.8,2.820332029998077,,,
"BlueRigger Digital Optical Audio Toslink Cable (3.3 Feet / 1 Meter) With 8 Channel (7.1) Audio Support (for Home Theatre, Xbox, Playstation etc.)",Home Entertainment,416.0,599.0,31,4.2,30023,267.35,1.56,1501150,,,,,,,,,,,,,126096.6,1.9870521120440996,,,
"Duracell Type-C To Micro 1.2M braided Sync & Charge Cable, USB C to Micro Fast Charge Compatible for fast data transmission (Black)",Computers,368.0,694.34,47,4.2,387,235.85,1.56,15480,,,,,,,,,949.0,0.3877766069546891,,,1625.4,3.012627395679764,,,
"Zoul USB Type C Fast Charging 3A Nylon Braided Data Cable Quick Charger Cable QC 3.0 for Samsung Galaxy M31s M30 S10 S9 S20 Plus, Note 10 9 8, A20e A40 A50 A70 (1M, Grey)",Computers,339.0,1093.55,69,4.3,974,217.26,1.56,38960,,,,,,,,,949.0,0.357218124341412,,,4188.2,4.4227934106788025,,,
MI Xiaomi USB Type C HYperCharge Cable 6A 100cm Sturdy and Durable Black Supports 120W HyperCharging,Computers,499.0,1313.16,62,4.3,30411,319.81,1.56,1216440,,,,,,,,,949.0,0.5258166491043204,,,130767.29999999999,3.974104224088199,,,
GENERIC Ultra-Mini Bluetooth CSR 4.0 USB Dongle Adapter for Windows Computer ( Black:Golden),Computers,249.0,399.0,38,3.4,4642,159.58,1.56,185680,,,,,,,,,949.0,0.2623814541622761,,,15782.8,2.435741298634703,,,
7SEVEN® Compatible for Tata Sky Remote Original Set Top HD Box and Suitable for SD Tata Play setup Box Remote Control,Home Entertainment,399.0,798.0,50,4.3,12,256.43,1.56,600,,,,,,,,,,,,,51.599999999999994,3.204922761361451,,,
"Belkin Apple Certified Lightning To Type C Cable, Fast Charging For Iphone, Ipad, Air Pods, 3.3 Feet (1 Meters)    White",Computers,1499.0,1999.0,25,4.4,1951,960.71,1.56,78040,,,,,,,,,949.0,1.5795574288724974,,,8584.400000000001,1.6024613806807255,,,
"ZEBRONICS HAA2021 HDMI version 2.1 cable with 8K @ 60Hz, 4K @ 120Hz, eARC & CEC support, 3D compatible, 2 meters length, 48Gbps max and Gold-plated connectors",Home Entertainment,637.0,1516.67,58,4.1,24,409.39,1.56,1200,,,,,,,,,,,,,98.39999999999999,3.717710403179283,,,
7SEVEN® Compatible for Sony Bravia LCD LED UHD OLED QLED 4K Ultra HD TV remote control with YouTube and NETFLIX Hotkeys. Universal Replacement for Original Sony Smart Android tv Remote Control,Home Entertainment,399.0,906.82,56,3.9,254,256.43,1.56,12700,,,,,,,,,,,,,990.6,3.589513492724825,,,
AmazonBasics Digital Optical Coax to Analog RCA Audio Converter Adapter with Fiber Cable,Home Entertainment,1089.0,1600.0,32,4.0,3565,699.88,1.56,178250,,,,,,,,,,,,,14260.0,2.051150567271329,,,
"Wayona Type C Cable Nylon Braided USB C QC 3.0 Fast Charging Short Power Bank Cable for Samsung Galaxy S10e/S10+/S10/S9/S9+/Note 9/S8/Note 8, LG G7 G5 G6, Moto G6 G7 (0.25M, Black)",Computers,339.0,997.06,66,4.3,6255,217.26,1.56,250200,,,,,,,,,949.0,0.357218124341412,,,26896.5,4.230498044997115,,,
"Pinnaclz Original Combo of 2 USB Type C Fast Charging Cable, USB C Data Cable for Charging and Data Transfer Smart Phones White 1.2 Meter Made in India (Pack of 2)",Computers,149.0,496.67,70,4.0,7732,95.49,1.56,309280,,,,,,,,,949.0,0.1570073761854583,,,30928.0,4.486891865906031,,,
Ambrane BCL-15 Lightning Cable for Smartphone (1.5m Black),Computers,149.0,402.7,63,3.9,57,95.49,1.56,2280,,,,,,,,,949.0,0.1570073761854583,,,222.29999999999998,4.038202679315428,,,
"Belkin USB C to USB-C Fast Charging Type C Cable, 60W PD, 3.3 feet (1 meter) for Laptop, Personal Computer, Tablet, Smartphone - Black, USB-IF Certified",Computers,599.0,849.0,29,4.5,577,383.9,1.56,23080,,,,,,,,,949.0,0.631190727081138,,,2596.5,1.8588552015896416,,,
LOHAYA Television Remote Compatible with Samsung Smart LED/LCD/HD TV Remote Control [ Compatible for All Samsung Tv Remote Control ],Home Entertainment,299.0,1196.0,75,3.9,1193,192.16,1.56,59650,,,,,,,,,,,,,4652.7,4.807384142042176,,,
"Wayona Nylon Braided Lightning USB Data Sync & 3A Charging Cable for iPhones, iPad Air, iPad Mini, iPod Nano and iPod Touch (3 FT Pack of 1, Grey)",Computers,399.0,1287.1,69,4.2,13120,255.72,1.56,524800,,,,,,,,,949.0,0.4204425711275026,,,55104.0,4.4227934106788025,,,
Electvision Remote Control Compatible with Kodak/Thomson Smart led tv (Without Voice) Before Placing Order for verification Contact Our coustmer Care 7738090464,Home Entertainment,339.0,1994.12,83,4.0,343,217.87,1.56,17150,,,,,,,,,,,,,1372.0,5.320171783860009,,,
"realme 10W Fast Charging Micro-USB Cable (Braided, Black)",Computers,249.0,399.0,38,4.0,6558,159.58,1.56,262320,,,,,,,,,949.0,0.2623814541622761,,,26232.0,2.435741298634703,,,
"TP-Link AC1300 USB WiFi Adapter (Archer T3U) - 2.4G/5G Dual Band Mini Wireless Network Adapter for PC Desktop, MU-MIMO Wi-Fi Dongle, USB 3.0, Supports Windows 11,10, 8.1, 8, 7, XP/Mac OS 10.15 and earlier",Computers,1399.0,2498.21,44,4.4,23169,896.62,1.56,926760,,,,,,,,,949.0,1.4741833508956796,,,101943.6,2.820332029998077,,,
"Ambrane 60W / 3A Fast Charging Output Cable with Micro to USB for Mobile, Neckband, True Wireless Earphone Charging, 480mbps Data Sync Speed, 1m Length (ACM - AZ1, Black)",Computers,149.0,402.7,63,4.0,1423,95.49,1.56,56920,,,,,,,,,949.0,0.1570073761854583,,,5692.0,4.038202679315428,,,
"Wayona USB Type C 65W Fast Charging 2M/6Ft Long Flash Charge Cable 3A QC 3.0 Data Cable Compatible with Samsung Galaxy S21 S10 S9 S8, iQOO Z3, Vivo, Note 10 9 8, A20e A40 A50 A70, Moto G7 G8 (2M, Grey)",Computers,325.0,984.85,67,4.3,2651,208.29,1.56,106040,,,,,,,,,949.0,0.3424657534246575,,,11399.3,4.294596500224344,,,
"Syncwire LTG to USB Cable for Fast Charging Compatible with Phone 5/ 5C/ 5S/ 6/ 6S/ 7/8/ X/XR/XS Max/ 11/12/ 13 Series and Pad Air/Mini, Pod & Other Devices (1.1 Meter, White)",Computers,399.0,1995.0,80,5.0,5,255.72,1.56,200,,,,,,,,,949.0,0.4204425711275026,,,25.0,5.127876418178322,,,
"Skadioo WiFi Adapter for pc | Car Accessories, WiFi Dongle for pc | USB WiFi Adapter for pc | Wi-Fi Receiver 2.4GHz, 802.11b/g/n UNano Size WiFi Dongle Compatible Adapter,WiFi dongle for pc",Computers,199.0,497.5,60,3.7,612,127.54,1.56,24480,,,,,,,,,949.0,0.2096944151738672,,,2264.4,3.845907313633741,,,
"FLiX (Beetel USB to Type C PVC Data Sync & 15W(3A) TPE Fast Charging Cable, Made in India, 480Mbps Data Sync, 1 Meter Long cable for all Andriod & all Type C Devices (Black)(XCD - FPC02)",Computers,88.0,303.45,71,4.0,9378,56.4,1.56,375120,,,,,,,,,949.0,0.0927291886195995,,,37512.0,4.55099032113326,,,
"Zoul USB C to USB C Fast Charging Cable 65W Type C to Type C Nylon Braided Cord Compatible with Macbook Oneplus 9 10R Samsung Galaxy S22 S21 Ultra Z Flip3 Macbook Air/Pro M1 Google Pixel 11'' iPad Pro 2020/2018 (2M, Grey)",Computers,399.0,1108.33,64,4.1,2685,255.72,1.56,107400,,,,,,,,,949.0,0.4204425711275026,,,11008.499999999998,4.102301134542658,,,
"FLiX (Beetel Flow USB to Micro USB PVC Data Sync & 12W(2.4A) Fast Charging Cable,Made in India,480Mbps Data Sync,Solid Cable,1 Meter Long cable for all Andriod & Micro USB Devices (Black)(XCD-FPM01)",Computers,57.89,199.62,71,4.0,9378,37.1,1.56,375120,,,,,,,,,949.0,0.0610010537407797,,,37512.0,4.55099032113326,,,
7SEVEN® Bluetooth Voice Command Remote for Xiaomi Redmi Mi Smart TV with Netflix & Prime Video Hot Keys XMRM-00A,Home Entertainment,799.0,1997.5,60,3.3,576,513.5,1.56,28800,,,,,,,,,,,,,1900.8,3.845907313633741,,,
Sony TV - Remote Compatible for Sony LED Remote Control Works with Sony LED TV by Trend Trail Speed tech & Remote hi Remote & REO India only,Home Entertainment,205.0,500.0,59,3.8,313,131.75,1.56,15650,,,,,,,,,,,,,1189.3999999999999,3.7818088584065124,,,
"Storite USB 3.0 Cable A to Micro B high Speed Upto 5 Gbps Data Transfer Cable for Portable External Hard Drive - (20cm), Black",Computers,299.0,695.35,57,4.1,2957,191.63,1.56,118280,,,,,,,,,949.0,0.3150684931506849,,,12123.699999999999,3.6536119479520544,,,
"AmazonBasics USB C to Lightning Aluminum with Nylon Braided MFi Certified Charging Cable (Grey, 1.2 meter)",Computers,949.0,2019.15,53,4.4,13552,608.21,1.56,542080,,,,,,,,,949.0,1.0,,,59628.8,3.397218127043138,,,
"AmazonBasics Double Braided Nylon USB Type-C to Type-C 2.0 Cable Smartphone (Dark Grey, 3 feet)",Computers,499.0,1188.1,58,4.3,5451,319.81,1.56,218040,,,,,,,,,949.0,0.5258166491043204,,,23439.3,3.717710403179283,,,
"Amazon Basics USB 3.0 Cable - A Male to Micro B - 6 Feet (1.8 Meters), Black",Computers,299.0,485.0,38,4.3,10911,191.63,1.56,436440,,,,,,,,,949.0,0.3150684931506849,,,46917.299999999996,2.435741298634703,,,
"AmazonBasics USB C to Lightning Aluminum with Nylon Braided MFi Certified Charging Cable (Grey, 1.8 meter)",Computers,949.0,2019.15,53,4.4,13552,608.21,1.56,542080,,,,,,,,,949.0,1.0,,,59628.8,3.397218127043138,,,
"Wayona Usb C 65W Fast Charging Cable Compatible For Tablets Samsung S22 S20 S10 S20Fe S21 S21 Ultra A70 A51 A71 A50S M31 M51 M31S M53 5G (1M, Black)",Computers,379.0,1114.71,66,4.3,2806,242.9,1.56,112240,,,,,,,,,949.0,0.3993677555321391,,,12065.8,4.230498044997115,,,
"BlueRigger Digital Optical Audio Toslink Cable (6 Feet / 1.8 Meter) With 8 Channel (7.1) Audio Support (for Home Theatre, Xbox, Playstation etc.)",Home Entertainment,486.0,2025.0,76,4.2,30023,312.34,1.56,1501150,,,,,,,,,,,,,126096.6,4.871482597269406,,,
"Amazon Basics USB A to Lightning MFi Certified Charging Cable (White, 1.2 meter)",Computers,709.0,2025.71,65,4.1,178817,454.4,1.56,7152680,,,,,,,,,949.0,0.7471022128556375,,,733149.7,4.1663995897698864,,,
LOHAYA Television Remote Compatible for VU LED LCD HD Tv Remote Control Model No :- EN2B27V,Home Entertainment,299.0,1196.0,75,3.7,490,192.16,1.56,24500,,,,,,,,,,,,,1813.0,4.807384142042176,,,
"Duracell Micro USB 3A Braided Sync & Fast Charging Cable, 3.9 Feet (1.2M). Supports QC 2.0/3.0 Charging, High Speed Data Transmission - Black",Computers,320.0,603.77,47,4.1,491,205.09,1.56,19640,,,,,,,,,949.0,0.3371970495258166,,,2013.1,3.012627395679764,,,
"Zebronics CU3100V Fast charging Type C cable with QC 18W support, 3A max capacity, 1 meter braided cable, Data transfer and Superior durability (Braided Black + White)",Computers,139.0,556.0,75,3.9,61,89.08,1.56,2440,,,,,,,,,949.0,0.1464699683877766,,,237.9,4.807384142042176,,,
"FLiX (Beetel) USB to iPhone Lightning Textured Pattern Data Sync & 2A Fast Charging Cable, Made in India, 480Mbps Data Sync, Tough Cable, 1 Meter Long USB Cable for Apple Devices (Black)(XCD-L102)",Computers,129.0,248.08,48,4.0,9378,82.68,1.56,375120,,,,,,,,,949.0,0.1359325605900948,,,37512.0,3.076725850906993,,,
"Belkin Apple Certified Lightning to USB Charge and Sync Cable for iPhone, iPad, Air Pods, 39.6 inch (100cm) – Black",Computers,999.0,1693.22,41,4.4,7318,640.26,1.56,292720,,,,,,,,,949.0,1.0526870389884089,,,32199.200000000004,2.6280366643163897,,,
